Altmetric Attention Score,Title,Journal/Collection Title,Journal ISSNs,Authors at my Institution,Departments,Output Type,OA Status,OA Type,Subjects (FoR),Sustainable Development Goals,Affiliations (GRID),Funder,Publication Date,DOI,ISBN,National Clinical Trial ID,URI,PubMed ID,PubMedCentral ID,Handle.net IDs,ADS Bibcode,arXiv ID,RePEc ID,SSRN,URN,News mentions,Blog mentions,Policy mentions,Patent mentions,Twitter mentions,Peer review mentions,Weibo mentions,Facebook mentions,Wikipedia mentions,Google+ mentions,LinkedIn mentions,Reddit mentions,Pinterest mentions,F1000 mentions,Q&A mentions,Video mentions,Syllabi mentions,Number of Mendeley readers,Number of Dimensions citations,Details Page URL,Badge URL,Publisher Names
1629,"COVID-19 and male reproductive function: a prospective, longitudinal cohort study","Reproduction","1470-1626, 1741-7899",,,Article,true,bronze,"11 Medical and Health Sciences; 1114 Paediatrics and Reproductive Medicine; 31 Biological Sciences; 3101 Biochemistry and Cell Biology; 32 Biomedical and Clinical Sciences; 3215 Reproductive Medicine",,"Allameh Tabataba'i University; University of Giessen",,2021-03-01,10.1530/rep-20-0382,,,,33522983,,"",,,,,,87,1,0,0,2537,0,0,2,1,0,0,0,0,0,0,0,0,112,50,https://www.altmetric.com/details/99307779,https://api.altmetric.com/v1/donut/99307779_240.png,
906,"The effects of three different exercise modalities on markers of male reproduction in healthy subjects: a randomized controlled trial","Reproduction","1470-1626, 1741-7899",,,Article,true,bronze,"11 Medical and Health Sciences; 1103 Clinical Sciences; 31 Biological Sciences; 3101 Biochemistry and Cell Biology; 32 Biomedical and Clinical Sciences",,"Academic Center for Education, Culture and Research; Allameh Tabataba'i University",,2017-02-01,10.1530/rep-16-0318,,,http://www.reproduction-online.org/lookup/doi/10.1530/REP-16-0318,27920258,,"",,,,,,128,1,0,0,22,0,0,6,0,2,0,1,0,0,0,0,0,117,38,https://www.altmetric.com/details/14481892,https://api.altmetric.com/v1/donut/14481892_240.png,
239,"Fear, Loss, Social Isolation, and Incomplete Grief Due to COVID-19: A Recipe for a Psychiatric Pandemic","Basic And Clinical Neuroscience","2228-7442, 2008-126X",,,Article,true,gold,"11 Medical and Health Sciences; 1117 Public Health and Health Services; 42 Health Sciences; 4203 Health Services and Systems",,"Allameh Tabataba'i University; Charles R. Drew University of Medicine and Science; Iran University of Medical Sciences",,2020-07-30,10.32598/bcn.11.covid19.2549.1,,,,32855782,,"",,,,,,30,2,0,0,1,0,0,0,0,0,0,0,0,0,0,0,0,190,52,https://www.altmetric.com/details/87800077,https://api.altmetric.com/v1/donut/87800077_240.png,
175,"Foundations of Social Policy and Welfare in Islam",,,,,Chapter,false,closed,"16 Studies in Human Society; 1605 Policy and Administration; 1608 Sociology; 22 Philosophy and Religious Studies; 2204 Religion and Religious Studies; 50 Philosophy and Religious Studies; 5004 Religious Studies",,"Allameh Tabataba'i University",,2020-12-19,10.1007/978-3-030-57753-7_2,,,,,,"",,,,,,21,1,0,0,0,0,0,0,0,0,0,0,0,0,0,0,0,7,2,https://www.altmetric.com/details/96690786,https://api.altmetric.com/v1/donut/96690786_240.png,"Springer Nature"
102,"Laughter yoga versus group exercise program in elderly depressed women: a randomized controlled trial","International Journal of Geriatric Psychiatry","0885-6230, 1099-1166",,,Article,true,green,"11 Medical and Health Sciences; 1103 Clinical Sciences; 32 Biomedical and Clinical Sciences; 3202 Clinical Sciences; 42 Health Sciences",,"Allameh Tabataba'i University; Imam Khomeini Hospital",,2010-09-16,10.1002/gps.2545,,,,20848578,,"",,,,,,9,3,2,0,3,0,0,0,1,0,0,0,0,0,0,0,0,317,131,https://www.altmetric.com/details/483088,https://api.altmetric.com/v1/donut/483088_240.png,"ESSOAr; Natural History Museum; Wiley"
97,"Manifesto for the future of work and organizational psychology","European Journal of Work and Organizational Psychology","1359-432X, 1464-0643",,,Article,true,hybrid,"15 Commerce, Management, Tourism and Services; 1503 Business and Management; 35 Commerce, Management, Tourism and Services; 3507 Strategy, Management and Organisational Behaviour",,"Aarhus University; Allameh Tabataba'i University; Carnegie Mellon University; KU Leuven; Leipzig University; Maastricht University; Nyenrode Business University; Queen Mary University of London; Radboud University Nijmegen; Tilburg University; Universität Innsbruck; University of Amsterdam; University of Barcelona; University of Bath; University of Bergen; University of Bristol; University of Jyväskylä; University of Lincoln; Vrije Universiteit Amsterdam; Vrije Universiteit Brussel","Economic and Social Research Council",2019-04-16,10.1080/1359432x.2019.1602041,,,,,,"",,,,,,0,0,0,0,185,0,0,0,0,0,0,0,0,0,0,0,0,149,31,https://www.altmetric.com/details/59093099,https://api.altmetric.com/v1/donut/59093099_240.png,"GeoScienceWorld; Taylor & Francis"
78,"Resistance exercise modulates male factor infertility through anti-inflammatory and antioxidative mechanisms in infertile men: A RCT","Life Sciences","0024-3205, 1879-0631",,,Article,false,closed,"11 Medical and Health Sciences; 1114 Paediatrics and Reproductive Medicine; 31 Biological Sciences; 3101 Biochemistry and Cell Biology; 32 Biomedical and Clinical Sciences; 3215 Reproductive Medicine",,"Allameh Tabataba'i University; University of Giessen",,2018-06-01,10.1016/j.lfs.2018.04.039,,,,29698651,,"",,,,,,5,0,0,1,64,0,0,2,0,0,0,0,0,0,0,1,0,132,25,https://www.altmetric.com/details/39049036,https://api.altmetric.com/v1/donut/39049036_240.png,"Elsevier BV"
66,"A Crisis in “Open Access”: Should Communication Scholarly Outputs Take 77 Years to Become Open Access?","SAGE Open",2158-2440,,,Article,true,gold,"13 Education; 1302 Curriculum and Pedagogy; 16 Studies in Human Society; 1608 Sociology; 1699 Other Studies In Human Society; 44 Human Society; 47 Language, Communication and Culture",,"Allameh Tabataba'i University; Alzahra University; Islamic Azad University, Tehran; Universiti Putra Malaysia; Universiti Sains Malaysia; University of Malaya; University of Tehran",,2019-08-22,10.1177/2158244019871044,,,,,,10760/38926,,,,,,0,16,0,0,242,0,0,0,1,0,0,2,0,0,0,0,0,35,10,https://www.altmetric.com/details/65321383,https://api.altmetric.com/v1/donut/65321383_240.png,"SAGE Publications"
57,"Low-to-moderate intensity aerobic exercise training modulates irritable bowel syndrome through antioxidative and inflammatory mechanisms in women: Results of a randomized controlled trial","Cytokine","1043-4666, 1096-0023",,,Article,false,closed,"11 Medical and Health Sciences; 1102 Cardiorespiratory Medicine and Haematology; 32 Biomedical and Clinical Sciences; 3202 Clinical Sciences",,"Academic Center for Education, Culture and Research; Allameh Tabataba'i University; Leibniz University Hannover; Mount St. Mary's University, Los Angeles, United States; University of Giessen; Urmia University",,2018-02-01,10.1016/j.cyto.2017.12.016,,,,29274540,,"",,,,,,1,1,0,0,81,0,0,2,0,0,0,0,0,0,0,1,0,166,48,https://www.altmetric.com/details/30882789,https://api.altmetric.com/v1/donut/30882789_240.png,"Elsevier BV"
50,"Gender Determines the Pattern of Correlation between Body Mass Index and Major Depressive Disorder among Children and Adolescents: Results from Iranian Children and Adolescents' Psychiatric Disorders Study","Childhood Obesity","2153-2168, 2153-2176",,,Article,false,closed,"11 Medical and Health Sciences; 1117 Public Health and Health Services; 32 Biomedical and Clinical Sciences; 3202 Clinical Sciences; 42 Health Sciences; 4206 Public Health",,"Ahvaz Jundishapur University of Medical Sciences; Allameh Tabataba'i University; Alzahra University; Arak University of Medical Sciences; Bushehr University of Medical Sciences; Golestan University of Medical Sciences; Guilan University of Medical Sciences; Hafez Hospital; Hamedan University of Medical Sciences; Hormozgan University of Medical Sciences; Islamic Azad University, Karaj; Islamic Azad University of Gorgan; Islamic Azad University of Najafabad; Islamic Azad University, Shahrood; Islamic Azad University, Yazd; Kerman University of Medical Sciences; Kurdistan University of Medical Sciences; Lorestan University of Medical Sciences; Medical University of Ilam; North Khorasan University of Medical Sciences; Payame Noor University; Qazvin University of Medical Sciences; Semnan University; Shahid Sadoughi University of Medical Sciences and Health Services; Shiraz University of Medical Sciences; Tabriz University of Medical Sciences; Tehran University of Medical Sciences; University of Science and Culture; Zanjan University of Medical Sciences",,2019-07-01,10.1089/chi.2018.0323,,,,31070473,,"",,,,,,5,1,0,0,16,0,0,1,0,0,0,0,0,0,0,0,0,67,7,https://www.altmetric.com/details/61897074,https://api.altmetric.com/v1/donut/61897074_240.png,"Mary Ann Liebert"
41,"Iran in transition","The Lancet","0099-5355, 0140-6736, 1474-547X",,,Article,true,green,"11 Medical and Health Sciences; 1117 Public Health and Health Services; 42 Health Sciences; 4206 Public Health","3 Good Health and Well Being","Allameh Tabataba'i University; American Cancer Society; Cornell University; Harvard University; Imperial College London; Iranian Academy of Medical Sciences; Iran University of Medical Sciences; Isfahan University of Medical Sciences; Kerman University of Medical Sciences; McGill University; Ministry of Health and Medical Education; Morgan State University; Oklahoma State University; Shahid Beheshti University of Medical Sciences; Shariati Hospital; Sharif University of Technology; Shiraz University of Medical Sciences; Stockholm University; Tabriz University of Medical Sciences; Tehran University of Medical Sciences; Tufts Medical Center; University of California, Berkeley; University of Oxford; World Health Organization","Economic and Social Research Council; Medical Research Council; World Health Organization",2019-05-01,10.1016/s0140-6736(18)33197-0,,,,31043324,,"",,,,,,0,0,1,0,63,0,0,1,1,0,0,0,0,0,0,0,0,221,99,https://www.altmetric.com/details/59651805,https://api.altmetric.com/v1/donut/59651805_240.png,"Elsevier BV; StatRef"
40,"Latent Variable Models and Networks: Statistical Equivalence and Testability","Multivariate Behavioral Research","0027-3171, 1532-7906",,,Article,true,hybrid,"01 Mathematical Sciences; 0104 Statistics; 35 Commerce, Management, Tourism and Services; 49 Mathematical Sciences; 52 Psychology",,"Allameh Tabataba'i University; University of Amsterdam; University of California, Davis",,2019-10-16,10.1080/00273171.2019.1672515,,,,,,"",,,,,,0,0,0,0,74,0,0,0,0,0,0,1,0,0,0,0,0,143,73,https://www.altmetric.com/details/68822709,https://api.altmetric.com/v1/donut/68822709_240.png,"GeoScienceWorld; Taylor & Francis"
31,"Music therapy: An effective approach in improving social skills of children with autism","Advanced Biomedical Research",2277-9175,,,Article,true,gold,"17 Psychology and Cognitive Sciences; 1701 Psychology; 36 Creative Arts and Writing; 3603 Music; 42 Health Sciences; 4201 Allied Health and Rehabilitation Science",,"Allameh Tabataba'i University; Islamic Azad University of Birjand; Kharazmi University; Shahid Chamran University of Ahvaz",,2015-01-01,10.4103/2277-9175.161584,,,,26380242,,"",,,,,,0,0,0,0,37,0,0,11,0,0,0,0,0,0,0,0,0,160,33,https://www.altmetric.com/details/4527468,https://api.altmetric.com/v1/donut/4527468_240.png,
30,"Child Abuse in Natural Disasters and Conflicts: A Systematic Review","Trauma, Violence, & Abuse","1524-8380, 1552-8324",,,Article,false,closed,"17 Psychology and Cognitive Sciences; 1701 Psychology; 44 Human Society; 4402 Criminology","1 No Poverty; 16 Peace, Justice and Strong Institutions","Allameh Tabataba'i University; Shahid Sadoughi University of Medical Sciences and Health Services; University of Social Welfare and Rehabilitation Sciences",,2019-03-13,10.1177/1524838019835973,,,,30866745,,"",,,,,,0,2,0,0,34,0,0,0,0,0,0,0,0,0,0,0,0,214,104,https://www.altmetric.com/details/57007454,https://api.altmetric.com/v1/donut/57007454_240.png,"SAGE Publications"
28,"Effectiveness of Therapeutic Exercise on Forward Head Posture: A Systematic Review and Meta-analysis","Journal of Manipulative & Physiological Therapeutics","0161-4754, 1532-6586",,,Article,false,closed,"11 Medical and Health Sciences; 1103 Clinical Sciences; 42 Health Sciences; 4201 Allied Health and Rehabilitation Science",,"Allameh Tabataba'i University; Bu-Ali Sina University; Tarbiat Modares University; University of Limerick",,2018-07-01,10.1016/j.jmpt.2018.02.002,,,,30107937,,"",,,,,,2,0,0,0,23,0,0,5,0,1,0,0,0,0,0,3,0,262,36,https://www.altmetric.com/details/46426997,https://api.altmetric.com/v1/donut/46426997_240.png,"Elsevier BV"
26,"A randomized controlled trial examining the effects of 16 weeks of moderate-to-intensive cycling and honey supplementation on lymphocyte oxidative DNA damage and cytokine changes in male road cyclists","Cytokine","1043-4666, 1096-0023",,,Article,false,closed,"11 Medical and Health Sciences; 1103 Clinical Sciences; 32 Biomedical and Clinical Sciences; 3204 Immunology",,"Academic Center for Education, Culture and Research; Allameh Tabataba'i University; Mount St. Mary's University, Los Angeles, United States; University of Giessen",,2016-12-01,10.1016/j.cyto.2016.09.016,,,http://linkinghub.elsevier.com/retrieve/pii/S104346661630521X,27676156,,"",,,,,,2,0,0,0,11,0,0,1,0,0,0,0,0,0,0,0,0,78,8,https://www.altmetric.com/details/12399701,https://api.altmetric.com/v1/donut/12399701_240.png,"Elsevier BV"
24,"Age of acquisition of 299 words in seven languages: American English, Czech, Gaelic, Lebanese Arabic, Malay, Persian and Western Armenian","PLOS ONE",1932-6203,,,Article,true,gold,"20 Language, Communication and Culture; 2004 Linguistics; 47 Language, Communication and Culture; 4704 Linguistics; 52 Psychology; 5204 Cognitive and Computational Psychology",,"Allameh Tabataba'i University; Czech Academy of Sciences; Imaging and Brain; Jagiellonian University; National University of Malaysia; Pennsylvania State University; Saint Joseph University; Universiti Putra Malaysia; University of Edinburgh; University of Reading; University of Warsaw","European Cooperation in Science and Technology; International Visegrad Fund; Ministry of Science and Higher Education; Polish Academy of Sciences",2019-08-08,10.1371/journal.pone.0220611,,,,,,"",,,,,,0,0,0,0,34,0,0,0,0,0,0,0,0,0,0,0,0,50,11,https://www.altmetric.com/details/64758959,https://api.altmetric.com/v1/donut/64758959_240.png,"Public Library of Science (PLOS)"
18,"Neurolaw: A brief introduction","Iranian Journal of Neurology",2008-384X,,,Article,false,closed,"18 Law and Legal Studies; 1801 Law; 48 Law and Legal Studies; 4804 Law In Context",,"Allameh Tabataba'i University",,2015-01-05,,,,,25874060,PMC4395810,"",,,,,,0,1,0,0,13,0,0,1,10,0,0,0,0,0,0,1,0,45,0,https://www.altmetric.com/details/4556976,https://api.altmetric.com/v1/donut/4556976_240.png,
17,"Moderate aerobic exercise training for improving reproductive function in infertile patients: A randomized controlled trial","Cytokine","1043-4666, 1096-0023",,,Article,false,closed,"11 Medical and Health Sciences; 1114 Paediatrics and Reproductive Medicine; 32 Biomedical and Clinical Sciences; 3215 Reproductive Medicine",,"Allameh Tabataba'i University; University of Giessen",,2017-04-01,10.1016/j.cyto.2017.01.007,,,http://linkinghub.elsevier.com/retrieve/pii/S1043466617300078,28092795,,"",,,,,,1,0,0,0,8,0,0,0,0,0,0,0,0,0,0,0,0,103,36,https://www.altmetric.com/details/15585552,https://api.altmetric.com/v1/donut/15585552_240.png,"Elsevier BV"
17,"High-Intensity Exercise Training for Improving Reproductive Function in Infertile Patients: A Randomized Controlled Trial","Journal of obstetrics and gynaecology Canada JOGC Journal d obstétrique et gynécologie du Canada JOGC",1701-2163,,,Article,false,closed,"11 Medical and Health Sciences; 1103 Clinical Sciences; 1114 Paediatrics and Reproductive Medicine; 32 Biomedical and Clinical Sciences; 3215 Reproductive Medicine; 42 Health Sciences; 4207 Sports Science and Exercise",,"Allameh Tabataba'i University; University of Giessen",,2017-07-01,10.1016/j.jogc.2017.03.097,,,,28625282,,"",,,,,,1,0,0,1,6,0,0,2,0,0,0,0,0,0,0,0,0,129,28,https://www.altmetric.com/details/21281351,https://api.altmetric.com/v1/donut/21281351_240.png,"Elsevier BV"
16,"Effects of curcumin supplementation on inflammatory biomarkers in patients with Rheumatoid Arthritis and Ulcerative colitis: A systematic review and meta-analysis","Complementary Therapies in Medicine","0965-2299, 1873-6963",,,Article,true,gold,"11 Medical and Health Sciences; 1103 Clinical Sciences; 42 Health Sciences; 4208 Traditional, Complementary and Integrative Medicine",,"Allameh Tabataba'i University; Kashan University of Medical Sciences; Shiraz University of Medical Sciences; Tehran University of Medical Sciences",,2021-09-01,10.1016/j.ctim.2021.102773,,,,34478838,,"",,,,,,1,0,0,0,11,0,0,1,1,0,0,0,0,0,0,0,0,46,9,https://www.altmetric.com/details/112683659,https://api.altmetric.com/v1/donut/112683659_240.png,"Elsevier BV"
16,"The Effect of Corruption on Internal Conflict in Iran Using Newspaper Coverage","Defence and Peace Economics","1024-2694, 1476-8267",,,Article,true,green,"14 Economics; 1402 Applied Economics; 35 Commerce, Management, Tourism and Services; 3502 Banking, Finance and Investment; 38 Economics; 3801 Applied Economics",,"Allameh Tabataba'i University; Economic Research Forum; Ifo Institute for Economic Research; Philipps University of Marburg",,2022-08-07,10.1080/10242694.2022.2108571,,,,,,"",,,,,,0,0,0,0,20,0,0,2,0,0,0,0,0,0,0,0,0,5,0,https://www.altmetric.com/details/133813800,https://api.altmetric.com/v1/donut/133813800_240.png,"GeoScienceWorld; Taylor & Francis"
14,"BNrich: A Bayesian network approach to the pathway enrichment analysis","bioRxiv","",,,Article,true,green,"14 Economics; 1403 Econometrics; 31 Biological Sciences; 3102 Bioinformatics and Computational Biology",,"Allameh Tabataba'i University; Institute for Research in Fundamental Sciences; Royan Institute; Sharif University of Technology; University of Tehran","Dalle Molle Institute for Artificial Intelligence Research",,10.1101/2020.01.13.905448,,,,,,"",,,,,,0,0,0,0,29,0,0,0,0,0,0,0,0,0,0,0,0,11,2,https://www.altmetric.com/details/74033540,https://api.altmetric.com/v1/donut/74033540_240.png,"Cold Spring Harbor Laboratory"
14,"Cross-cultural adaptation, reliability, and validity of the autism treatment evaluation checklist in persian.","Iranian Journal of Pediatrics","1018-4406, 2008-2142, 2008-2150",,,Article,false,closed,"11 Medical and Health Sciences; 1114 Paediatrics and Reproductive Medicine; 1117 Public Health and Health Services; 32 Biomedical and Clinical Sciences; 3213 Paediatrics",,"Allameh Tabataba'i University; Tehran University of Medical Sciences",,2013-06-01,,,,,23795248,,"",,,,,,0,1,0,0,3,0,0,1,1,1,0,0,0,0,0,0,0,47,0,https://www.altmetric.com/details/1583868,https://api.altmetric.com/v1/donut/1583868_240.png,
13,"Artificial intelligence used to diagnose osteoporosis from risk factors in clinical data and proposing sports protocols","Scientific Reports",2045-2322,,,Article,true,gold,"08 Information and Computing Sciences; 0801 Artificial Intelligence and Image Processing; 11 Medical and Health Sciences; 1103 Clinical Sciences; 1117 Public Health and Health Services; 32 Biomedical and Clinical Sciences; 3202 Clinical Sciences",,"Allameh Tabataba'i University; Iran University of Science and Technology; Tarbiat Modares University",,2022-10-31,10.1038/s41598-022-23184-y,,,,36316387,,"",,,,,,0,0,0,0,35,0,0,0,0,0,0,0,0,0,0,0,0,6,0,https://www.altmetric.com/details/137903982,https://api.altmetric.com/v1/donut/137903982_240.png,"Scientific American; Springer Nature"
13,"Pathological narcissism, brain behavioral systems and tendency to substance abuse: The mediating role of self-control","Personality & Individual Differences",0191-8869,,,Article,false,closed,"17 Psychology and Cognitive Sciences; 1701 Psychology; 52 Psychology; 5205 Social and Personality Psychology","3 Good Health and Well Being","Allameh Tabataba'i University; University of Guilan; University of Mohaghegh Ardabili",,2016-01-01,10.1016/j.paid.2015.09.019,,,,,,"",,,,,,1,0,0,0,1,0,0,0,0,0,0,0,0,0,0,0,0,68,16,https://www.altmetric.com/details/8630246,https://api.altmetric.com/v1/donut/8630246_240.png,"Elsevier BV"
12,"The therapeutic effects of methylphenidate and matrix-methylphenidate on addiction severity, craving, relapse and mental health in the methamphetamine use disorder","Substance Abuse Treatment, Prevention, and Policy",1747-597X,,,Article,true,gold,"17 Psychology and Cognitive Sciences; 1701 Psychology; 52 Psychology; 5202 Biological Psychology","3 Good Health and Well Being","Allameh Tabataba'i University; Kashan University of Medical Sciences; Kermanshah University of Medical Sciences",,2020-09-25,10.1186/s13011-020-00317-y,,,,32977820,,"",,,,,,0,1,0,0,7,0,0,0,0,0,0,1,0,0,0,0,0,25,7,https://www.altmetric.com/details/91353967,https://api.altmetric.com/v1/donut/91353967_240.png,"BioMed Central; Springer Nature"
12,"Effect of exercise augmentation of cognitive behavioural therapy for the treatment of suicidal ideation and depression","Journal of Affective Disorders","0165-0327, 1573-2517",,,Article,false,closed,"11 Medical and Health Sciences; 1103 Clinical Sciences; 1117 Public Health and Health Services; 17 Psychology and Cognitive Sciences; 1701 Psychology; 32 Biomedical and Clinical Sciences; 3202 Clinical Sciences; 42 Health Sciences; 52 Psychology; 5203 Clinical and Health Psychology",,"Allameh Tabataba'i University; Alzahra University; Semnan University; Shahid Beheshti University; Shiraz University of Medical Sciences; Stockholm University; University of Regina",,2017-09-01,10.1016/j.jad.2017.05.012,,,,28525821,,"",,,,,,0,0,0,0,17,0,0,1,0,0,0,0,0,0,0,0,0,189,32,https://www.altmetric.com/details/19962628,https://api.altmetric.com/v1/donut/19962628_240.png,"Elsevier BV"
12,"The Relationship between Personality Disorders and the Type of Crime Committed and Substance Used among Prisoners.","Addiction and Health","2008-4633, 2008-8469",,,Article,false,closed,"11 Medical and Health Sciences; 1103 Clinical Sciences; 1117 Public Health and Health Services; 52 Psychology; 5201 Applied and Developmental Psychology; 5205 Social and Personality Psychology","3 Good Health and Well Being","Allameh Tabataba'i University; Kerman University of Medical Sciences; Shahid Beheshti University",,2017-04-01,,,,,29299208,PMC5742412,"",,,,,,0,0,0,0,13,0,0,0,0,0,0,0,0,0,0,0,0,80,0,https://www.altmetric.com/details/31292177,https://api.altmetric.com/v1/donut/31292177_240.png,
11,"Administration of dietary antioxidants for patients with inflammatory bowel disease: A systematic review and meta-analysis of randomized controlled clinical trials","Complementary Therapies in Medicine","0965-2299, 1873-6963",,,Article,true,gold,"11 Medical and Health Sciences; 1103 Clinical Sciences; 42 Health Sciences; 4208 Traditional, Complementary and Integrative Medicine",,"Ahvaz Jundishapur University of Medical Sciences; Allameh Tabataba'i University; Golestan University of Medical Sciences; Iran University of Medical Sciences; Kashan University of Medical Sciences; Semnan University of Medical Sciences; Shahid Sadoughi University of Medical Sciences and Health Services; Tehran University of Medical Sciences; Universal Scientific Education and Research Network",,2021-12-01,10.1016/j.ctim.2021.102787,,,,34751147,,"",,,,,,0,0,0,0,21,0,0,1,0,0,0,0,0,0,0,0,0,26,1,https://www.altmetric.com/details/116023209,https://api.altmetric.com/v1/donut/116023209_240.png,"Elsevier BV"
10,"The religious person revisited: cross-cultural evidence from the HEXACO model of personality structure","Mental Health, Religion &amp; Culture","1367-4676, 1469-9737",,,Article,false,closed,"17 Psychology and Cognitive Sciences; 1701 Psychology; 1702 Cognitive Sciences; 52 Psychology; 5205 Social and Personality Psychology",,"Allameh Tabataba'i University; Kansas City University of Medicine and Biosciences",,2012-11-05,10.1080/13674676.2012.737771,,,,,,"",,,,,,0,1,0,0,1,0,0,0,0,0,0,0,0,0,0,0,0,45,27,https://www.altmetric.com/details/1200502,https://api.altmetric.com/v1/donut/1200502_240.png,"GeoScienceWorld; Routledge; Taylor & Francis"
10,"Developing Verb Picture Naming Test for Persian adults and determining its psychometric properties","Applied Neuropsychology: Adult",,,,Article,false,closed,"17 Psychology and Cognitive Sciences; 1701 Psychology; 42 Health Sciences; 52 Psychology; 5202 Biological Psychology; 5204 Cognitive and Computational Psychology",,"Allameh Tabataba'i University; Tehran University of Medical Sciences",,2020-05-12,10.1080/23279095.2020.1762085,,,,32396016,,"",,,,,,1,0,0,0,1,0,0,0,0,0,0,0,0,0,0,0,0,14,2,https://www.altmetric.com/details/81909243,https://api.altmetric.com/v1/donut/81909243_240.png,"GeoScienceWorld; Taylor & Francis"
9,"Does a brief mindfulness intervention counteract the detrimental effects of ego depletion in basketball free throw under pressure?","Sport, Exercise, and Performance Psychology","2157-3913, 2157-3905",,,Article,true,green,"11 Medical and Health Sciences; 1103 Clinical Sciences; 17 Psychology and Cognitive Sciences; 1701 Psychology; 52 Psychology; 5203 Clinical and Health Psychology",,"Abertay University; Allameh Tabataba'i University; University of Padua",,2020-05-01,10.1037/spy0000201,,,,,,"",,,,,,0,1,0,0,2,0,0,0,0,0,0,0,0,0,0,0,0,93,14,https://www.altmetric.com/details/81814685,https://api.altmetric.com/v1/donut/81814685_240.png,"American Psychological Association (APA)"
