1,"A systematic review and meta-analysis: The effects of probiotic supplementation on metabolic profile in patients with neurological disorders","Complementary Therapies in Medicine","0965-2299, 1873-6963",,,Article,false,closed,"11 Medical and Health Sciences; 1103 Clinical Sciences; 42 Health Sciences; 4208 Traditional, Complementary and Integrative Medicine",,"Allameh Tabataba'i University; Halal Research Center; Kashan University of Medical Sciences; Shahrekord University of Medical Sciences; Tehran University of Medical Sciences; University Hospital Centre Zagreb; University of Maragheh; University of Zagreb",,2020-09-01,10.1016/j.ctim.2020.102507,,,,33066850,,"",,,,,,0,0,0,0,1,0,0,0,0,0,0,0,0,0,0,0,0,31,11,https://www.altmetric.com/details/102569734,https://api.altmetric.com/v1/donut/102569734_240.png,"Elsevier BV"
1,"Impact of Perceived Social Apathy on Tourists’ Behavioral Intentions","Leisure Studies","0261-4367, 1466-4496",,,Article,false,closed,"15 Commerce, Management, Tourism and Services; 1504 Commercial Services; 1506 Tourism; 16 Studies in Human Society; 1608 Sociology; 35 Commerce, Management, Tourism and Services; 3504 Commercial Services; 3506 Marketing; 3508 Tourism",,"Allameh Tabataba'i University",,2021-02-25,10.1080/02614367.2021.1888308,,,,,,"",,,,,,0,0,0,0,1,0,0,0,0,0,0,0,0,0,0,0,0,13,2,https://www.altmetric.com/details/101822284,https://api.altmetric.com/v1/donut/101822284_240.png,"GeoScienceWorld; Taylor & Francis"
1,"Commentary on Atari, Graham, & Dehghani, 2020: Altruistic helping intentions among Iranians reflect target Kin's reproductive value","Evolution & Human Behavior",1090-5138,,,Article,false,closed,"16 Studies in Human Society; 1601 Anthropology; 17 Psychology and Cognitive Sciences; 1701 Psychology; 1702 Cognitive Sciences; 52 Psychology; 5202 Biological Psychology; 5204 Cognitive and Computational Psychology; 5205 Social and Personality Psychology",,"Allameh Tabataba'i University; University of Michigan–Ann Arbor",,2021-05-01,10.1016/j.evolhumbehav.2021.02.002,,,,,,"",,,,,,0,0,0,0,1,0,0,0,0,0,0,0,0,0,0,0,0,1,2,https://www.altmetric.com/details/101651850,https://api.altmetric.com/v1/donut/101651850_240.png,"Elsevier BV"
1,"Tehran’s house price ripple effects in Iran: application of bootstrap asymmetric panel granger non-causality in the frequency domain","Housing Studies","0267-3037, 1466-1810",,,Article,false,closed,"14 Economics; 1402 Applied Economics; 1403 Econometrics; 38 Economics; 3801 Applied Economics; 3802 Econometrics; 44 Human Society",,"Allameh Tabataba'i University; Feng Chia University; Sultan Qaboos University; Western Sydney University",,2020-12-03,10.1080/02673037.2020.1853072,,,,,,1959.7/uws:59002,,,,,,0,0,0,0,1,0,0,0,0,0,0,0,0,0,0,0,0,5,0,https://www.altmetric.com/details/101479008,https://api.altmetric.com/v1/donut/101479008_240.png,"GeoScienceWorld; Taylor & Francis"
1,"A Thorough Analysis of Potential Geothermal Project Locations in Afghanistan","Sustainability",2071-1050,,,Article,true,gold,"12 Built Environment and Design; 40 Engineering; 46 Information and Computing Sciences; 4605 Data Management and Data Science","7 Affordable and Clean Energy; 13 Climate Action","Allameh Tabataba'i University; Duy Tan University; Islamic Azad University of Shahrekord; Prince of Songkla University; Sharif University of Technology",,2020-10-12,10.3390/su12208397,,,,,,"",,,,,,0,0,0,0,1,0,0,0,0,0,0,0,0,0,0,0,0,50,27,https://www.altmetric.com/details/92260620,https://api.altmetric.com/v1/donut/92260620_240.png,"MDPI"
1,"Planning conditions (strategic planning, task repetition, and joint planning), cognitive task complexity, and task type: Effects on L2 oral performance","System",0346-251X,,,Article,false,closed,"13 Education; 1301 Education Systems; 39 Education; 3901 Curriculum and Pedagogy; 47 Language, Communication and Culture; 4703 Language Studies; 4704 Linguistics",,"Allameh Tabataba'i University",,2020-10-01,10.1016/j.system.2020.102297,,,,,,"",,,,,,0,0,0,0,1,0,0,0,0,0,0,0,0,0,0,0,0,45,8,https://www.altmetric.com/details/89399702,https://api.altmetric.com/v1/donut/89399702_240.png,"Elsevier BV"
1,"Iranian doctoral students’ shared experience of English-medium publication: the case of humanities and social sciences","Higher Education","0018-1560, 1573-174X",,,Article,false,closed,"13 Education; 1301 Education Systems; 1302 Curriculum and Pedagogy; 1303 Specialist Studies In Education; 39 Education; 3903 Education Systems; 3904 Specialist Studies In Education",,"Allameh Tabataba'i University; Ilam University; Sharif University of Technology",,2019-12-16,10.1007/s10734-019-00478-1,,,,,,"",,,,,,0,0,0,0,1,0,0,1,0,0,0,0,0,0,0,0,0,27,4,https://www.altmetric.com/details/87195442,https://api.altmetric.com/v1/donut/87195442_240.png,"Springer Nature"
1,"A Computational Model for Measuring Trust in Mobile Social Networks Using Fuzzy Logic","International Journal of Automation and Computing","1476-8186, 1751-8520",,,Article,false,closed,"08 Information and Computing Sciences; 0806 Information Systems; 46 Information and Computing Sciences; 4605 Data Management and Data Science; 4608 Human-Centred Computing",,"Allameh Tabataba'i University",,2020-05-20,10.1007/s11633-020-1232-5,,,,,,"",,,,,,0,0,0,0,2,0,0,0,0,0,0,0,0,0,0,0,0,8,2,https://www.altmetric.com/details/82459243,https://api.altmetric.com/v1/donut/82459243_240.png,"Springer Nature"
1,"Typology of scaffolding in teacher discourse: Large data‐based evidence from second language classrooms","International Journal of Applied Linguistics","0802-6106, 1473-4192",,,Article,false,closed,"17 Psychology and Cognitive Sciences; 1702 Cognitive Sciences; 20 Language, Communication and Culture; 2004 Linguistics; 39 Education; 3904 Specialist Studies In Education; 47 Language, Communication and Culture; 4704 Linguistics",,"Allameh Tabataba'i University; Tarbiat Modares University",,2020-02-09,10.1111/ijal.12286,,,,,,"",,,,,,0,0,0,0,1,0,0,0,0,0,0,0,0,0,0,0,0,40,5,https://www.altmetric.com/details/75756372,https://api.altmetric.com/v1/donut/75756372_240.png,"Wiley"
1,"Reflection on working culture in public organizations: The case of three Iranian Higher Education Institutions","Cogent Social Sciences",2331-1886,,,Article,true,gold,"15 Commerce, Management, Tourism and Services; 1503 Business and Management; 39 Education; 3902 Education Policy, Sociology and Philosophy; 3903 Education Systems","4 Quality Education","Allameh Tabataba'i University",,2019-07-01,10.1080/23311886.2019.1630932,,,,,,"",,,,,,0,0,0,0,1,0,0,0,0,0,0,0,0,0,0,0,0,9,2,https://www.altmetric.com/details/62937752,https://api.altmetric.com/v1/donut/62937752_240.png,"GeoScienceWorld; Taylor & Francis"
1,"Integrative Self-Knowledge and Mental Health","Procedia Social and Behavioral Sciences",1877-0428,,,Article,true,gold,"17 Psychology and Cognitive Sciences; 1701 Psychology; 52 Psychology; 5203 Clinical and Health Psychology; 5205 Social and Personality Psychology",,"Allameh Tabataba'i University; University of Tehran",,2011-01-01,10.1016/j.sbspro.2011.10.137,,,,,,"",,,,,,0,0,0,0,1,0,0,0,0,0,0,0,0,0,0,0,0,18,3,https://www.altmetric.com/details/50616429,https://api.altmetric.com/v1/donut/50616429_240.png,"Elsevier BV"
1,"A phenomenological study on the meaning of educational justice for street children","Education, Citizenship and Social Justice","1746-1979, 1746-1987",,,Article,false,closed,"13 Education; 1303 Specialist Studies In Education; 39 Education; 3904 Specialist Studies In Education","16 Peace, Justice and Strong Institutions","Allameh Tabataba'i University; Malayer University",,2018-03-23,10.1177/1746197918760083,,,,,,"",,,,,,0,0,0,0,1,0,0,0,0,0,0,0,0,0,0,0,0,34,0,https://www.altmetric.com/details/34873362,https://api.altmetric.com/v1/donut/34873362_240.png,"SAGE Publications"
1,"A Bayesian Approach to Robust Skewed Autoregressive Processes","Calcutta Statistical Association Bulletin",0008-0683,,,Article,false,closed,"01 Mathematical Sciences; 0104 Statistics; 49 Mathematical Sciences; 4905 Statistics",,"Allameh Tabataba'i University; Fasa University of Medical Sciences; Pontificia Universidad Católica de Chile; Shiraz University; University of Connecticut",,2018-01-15,10.1177/0008068317732196,,,,,,"",,,,,,0,0,0,0,1,0,0,0,0,0,0,0,0,0,0,0,0,7,22,https://www.altmetric.com/details/32056160,https://api.altmetric.com/v1/donut/32056160_240.png,"SAGE Publications"
1,"A novel database for automatic processing of Persian handwritten bank checks","Pattern Recognition",0031-3203,,,Article,false,closed,"08 Information and Computing Sciences; 0801 Artificial Intelligence and Image Processing; 46 Information and Computing Sciences; 4603 Computer Vision and Multimedia Computation; 4605 Data Management and Data Science; 4611 Machine Learning",,"Allameh Tabataba'i University; Bahria University; Concordia University, Montreal, Canada; Semnan University; Université Larbi Tébessi; University of Birjand",,2018-02-01,10.1016/j.patcog.2017.09.011,,,,,,"",,,,,,0,0,0,0,1,0,0,0,0,0,0,0,0,0,0,0,0,33,13,https://www.altmetric.com/details/26307761,https://api.altmetric.com/v1/donut/26307761_240.png,"Elsevier BV"
1,"A new multi-criteria model based on interval type-2 fuzzy sets and EDAS method for supplier evaluation and order allocation with environmental considerations","Computers & Industrial Engineering",0360-8352,,,Article,false,closed,"01 Mathematical Sciences; 08 Information and Computing Sciences; 09 Engineering; 46 Information and Computing Sciences; 4602 Artificial Intelligence; 4605 Data Management and Data Science",,"Allameh Tabataba'i University; Vilnius Gediminas Technical University",,2017-10-01,10.1016/j.cie.2017.08.017,,,,,,"",,,,,,0,0,0,0,2,0,0,0,0,0,0,0,0,0,0,0,0,112,117,https://www.altmetric.com/details/24181177,https://api.altmetric.com/v1/donut/24181177_240.png,"Elsevier BV"
1,"Effects of aerobic exercise training on ACE and ADRB2 gene expression, plasma angiotensin II level, and flow-mediated dilation: a study on obese postmenopausal women with prehypertension","Menopause (New York, N.Y.)","1072-3714, 1530-0374",,,Article,false,closed,"11 Medical and Health Sciences; 1103 Clinical Sciences; 32 Biomedical and Clinical Sciences; 42 Health Sciences; 4207 Sports Science and Exercise",,"Allameh Tabataba'i University; Hacettepe University",,2017-03-01,10.1097/gme.0000000000000762,,,http://journals.lww.com/menopausejournal/Fulltext/publishahead/Effects_of_aerobic_exercise_training_on_ACE_and.97897.aspx,28231078,,"",,,,,,0,0,0,0,1,0,0,0,0,0,0,0,0,0,0,0,0,112,17,https://www.altmetric.com/details/12950873,https://api.altmetric.com/v1/donut/12950873_240.png,"Lippincott Williams & Wilkins (LWW)"
1,"Developing science gateways for drug discovery in a grid environment","SpringerPlus",2193-1801,,,Article,true,gold,"08 Information and Computing Sciences; 0801 Artificial Intelligence and Image Processing; 0806 Information Systems; 34 Chemical Sciences; 3404 Medicinal and Biomolecular Chemistry; 46 Information and Computing Sciences; 4606 Distributed Computing and Systems Software; 4613 Theory Of Computation",,"Allameh Tabataba'i University; Chinese Academy of Sciences; Universidad Católica San Antonio de Murcia; Universiti Malaysia Pahang; University of Notre Dame","Fundación Seneca",2016-08-09,10.1186/s40064-016-2914-x,,,,27547674,,"",,,,,,0,0,0,0,1,0,0,0,0,0,0,0,0,0,0,0,0,21,12,https://www.altmetric.com/details/10353423,https://api.altmetric.com/v1/donut/10353423_240.png,"BioMed Central; Springer Nature"
1,"Comparing Sensory Information Processing and Alexithymia between People with Substance Dependency and Normal.","Addiction and Health","2008-4633, 2008-8469",,,Article,false,closed,"17 Psychology and Cognitive Sciences; 1701 Psychology; 32 Biomedical and Clinical Sciences; 3202 Clinical Sciences; 52 Psychology","3 Good Health and Well Being","Allameh Tabataba'i University; University of Mohaghegh Ardabili",,2015-01-01,,,,,26885354,,"",,,,,,0,0,0,0,1,0,0,0,0,0,0,0,0,0,0,0,0,6,0,https://www.altmetric.com/details/9711907,https://api.altmetric.com/v1/donut/9711907_240.png,
1,"A pilot randomized controlled trial comparing computer-assisted cognitive rehabilitation, stimulant medication, and an active control in the treatment of ADHD","Child & Adolescent Mental Health","1475-357X, 1475-3588",,,Article,false,closed,"11 Medical and Health Sciences; 1103 Clinical Sciences; 52 Psychology; 5201 Applied and Developmental Psychology; 5202 Biological Psychology; 5203 Clinical and Health Psychology",,"Allameh Tabataba'i University; Shahid Beheshti University; Tarbiat Modares University; University of Bojnord; University of California, Irvine",,2016-04-07,10.1111/camh.12157,,,,,,"",,,,,,0,0,0,0,1,0,0,1,0,0,0,0,0,0,0,0,0,77,8,https://www.altmetric.com/details/6523321,https://api.altmetric.com/v1/donut/6523321_240.png,"Wiley"
1,"Student perceptions of effective discussion in online forums: a case study of pre-service teachers","Innovations in Education and Teaching International","1470-3297, 1470-3300",,,Article,false,closed,"13 Education; 1303 Specialist Studies In Education; 39 Education; 3901 Curriculum and Pedagogy","4 Quality Education","Allameh Tabataba'i University; Alzahra University; Islamic Azad University, Tehran",,2016-02-05,10.1080/14703297.2016.1143858,,,,,,"",,,,,,0,0,0,0,1,0,0,0,0,0,0,0,0,0,0,0,0,53,7,https://www.altmetric.com/details/5518366,https://api.altmetric.com/v1/donut/5518366_240.png,"GeoScienceWorld; Taylor & Francis"
1,"The Effect of Stress Management Model in Quality of Life in Breast Cancer Women","Iranian Journal of Cancer Prevention","2008-2398, 2008-2401",,,Article,true,hybrid,"11 Medical and Health Sciences; 1112 Oncology and Carcinogenesis; 42 Health Sciences; 4203 Health Services and Systems; 4205 Nursing",,"Allameh Tabataba'i University; Khatam University; Shahid Beheshti University of Medical Sciences",,2015-08-24,10.17795/ijcp-3435,,,,26478793,,"",,,,,,0,0,0,0,1,0,0,0,0,0,0,0,0,0,0,0,0,37,11,https://www.altmetric.com/details/4651222,https://api.altmetric.com/v1/donut/4651222_240.png,
1,"The association between aggressive and non-aggressive antisocial problems as measured with the Achenbach System of Empirically Based Assessment: A study of 27,861 parent–adolescent dyads from 25 societies","Personality & Individual Differences",0191-8869,,,Article,false,closed,"17 Psychology and Cognitive Sciences; 1701 Psychology; 52 Psychology; 5202 Biological Psychology; 5205 Social and Personality Psychology",,"Aalborg University Hospital; Allameh Tabataba'i University; Ankara University; Babeș-Bolyai University; Bryn Mawr College; Chinese University of Hong Kong; Chuo University; Columbia University; Erasmus MC - Sophia Children’s Hospital; Harran University; Institute of Psychology, Beijing, China; Medical University of Warsaw; Michigan State University; Mykolas Romeris University; National University Hospital of Iceland; University Hospital Centre Zagreb; University of Adelaide; University of Basel; University of Helsinki; University of North Carolina System; University of Southern Denmark; University of Vermont; University of Zagreb; University of Zurich; Women's and Children's Hospital; Yonsei University",,2015-10-01,10.1016/j.paid.2015.04.036,,,http://linkinghub.elsevier.com/retrieve/pii/S0191886915002998,,,2440/98749,,,,,,0,0,0,0,1,0,0,0,0,0,0,0,0,0,0,0,0,56,12,https://www.altmetric.com/details/4574743,https://api.altmetric.com/v1/donut/4574743_240.png,"Elsevier BV"
1,"Mental health status, aggression, and poor driving distinguish traffic offenders from non-offenders but health status predicts driving behavior in both groups","Neuropsychiatric Disease and Treatment","1176-6328, 1178-2021",,,Article,true,gold,"11 Medical and Health Sciences; 1117 Public Health and Health Services; 32 Biomedical and Clinical Sciences; 3202 Clinical Sciences; 3209 Neurosciences","3 Good Health and Well Being","Allameh Tabataba'i University; Kermanshah University of Medical Sciences; University of Basel",,2015-08-01,10.2147/ndt.s89916,,,,26300646,,"",,,,,,0,0,0,0,3,0,0,0,0,0,0,0,0,0,0,0,0,50,13,https://www.altmetric.com/details/4382839,https://api.altmetric.com/v1/donut/4382839_240.png,"Dove Medical Press Ltd."
1,"Factors affecting internet frauds in private sector: A case study in Cyberspace Surveillance and Scam Monitoring Agency of Iran","Computers in Human Behavior",0747-5632,,,Article,false,closed,"08 Information and Computing Sciences; 0806 Information Systems; 17 Psychology and Cognitive Sciences; 1701 Psychology; 1702 Cognitive Sciences; 46 Information and Computing Sciences; 4608 Human-Centred Computing; 52 Psychology; 5201 Applied and Developmental Psychology; 5204 Cognitive and Computational Psychology",,"Allameh Tabataba'i University",,2015-10-01,10.1016/j.chb.2015.04.058,,,,,,"",,,,,,0,0,0,0,1,0,0,0,0,0,0,0,0,0,0,0,0,125,17,https://www.altmetric.com/details/4052594,https://api.altmetric.com/v1/donut/4052594_240.png,"Elsevier BV"
1,"AN ANALYSIS OF ADOPTING DUAL PRICING FOR MUSEUMS","Annals of Tourism Research",0160-7383,,,Article,false,closed,"15 Commerce, Management, Tourism and Services; 1504 Commercial Services; 1505 Marketing; 1506 Tourism; 35 Commerce, Management, Tourism and Services; 3506 Marketing; 3508 Tourism",,"Allameh Tabataba'i University; University of Ljubljana; University of Wisconsin System",,2013-10-01,10.1016/j.annals.2013.04.001,,,,,,"",,,,,,0,0,0,0,1,0,0,0,0,0,0,0,0,0,0,0,0,69,24,https://www.altmetric.com/details/3743489,https://api.altmetric.com/v1/donut/3743489_240.png,"Elsevier BV"
1,"Does discarding XML declarations and changing file extensions improve the indexability and visibility of metadata tag names in web search engines?","Journal of Information Science","0165-5515, 1741-6485",,,Article,false,closed,"08 Information and Computing Sciences; 0804 Data Format; 46 Information and Computing Sciences; 4605 Data Management and Data Science; 4609 Information Systems",,"Allameh Tabataba'i University; Ferdowsi University of Mashhad; Islamic Azad University, Science and Research Branch",,2014-09-25,10.1177/0165551514550139,,,,,,"",,,,,,0,0,0,0,1,0,0,0,0,0,0,0,0,0,0,0,0,7,0,https://www.altmetric.com/details/2717886,https://api.altmetric.com/v1/donut/2717886_240.png,"SAGE Publications"
1,"Language identity among Iranian English language learners: a nationwide survey","Journal of Multilingual and Multicultural Development","0143-4632, 1747-7557",,,Article,false,closed,"20 Language, Communication and Culture; 2004 Linguistics; 39 Education; 3901 Curriculum and Pedagogy; 3903 Education Systems","4 Quality Education","Allameh Tabataba'i University; Shahid Beheshti University; Sharif University of Technology",,2014-02-24,10.1080/01434632.2014.889140,,,,,,"",,,,,,0,0,0,0,1,0,0,0,0,0,0,0,0,0,0,0,0,45,9,https://www.altmetric.com/details/2318817,https://api.altmetric.com/v1/donut/2318817_240.png,"GeoScienceWorld; Taylor & Francis"
1,"Evolutionary Pathways of Ecosystem Literature in Organization and Management Studies",,,,,Article,true,green,"06 Biological Sciences; 0602 Ecology; 46 Information and Computing Sciences; 4610 Library and Information Studies",,"Allameh Tabataba'i University; National Research Council, Rome, Italy",,2023-01-21,10.21203/rs.3.rs-2499460/v1,,,,,,"",,,,,,0,0,0,0,1,0,0,0,0,0,0,0,0,0,0,0,0,0,0,https://www.altmetric.com/details/141608410,https://api.altmetric.com/v1/donut/141608410_240.png,"Research Square"
1,"Modeling the Impact of Mentoring on Women’s Work-Life Balance: A Grounded Theory Approach",,,,,Article,true,green,"16 Studies in Human Society; 1699 Other Studies In Human Society; 35 Commerce, Management, Tourism and Services; 3505 Human Resources and Industrial Relations; 44 Human Society; 4405 Gender Studies",,"Allameh Tabataba'i University; Budapest Business School; Magyar Agrár- és Élettudományi Egyetem",,2022-12-21,10.21203/rs.3.rs-2398153/v1,,,,,,"",,,,,,0,0,0,0,1,0,0,0,0,0,0,0,0,0,0,0,0,0,0,https://www.altmetric.com/details/140385383,https://api.altmetric.com/v1/donut/140385383_240.png,"Research Square"
1,"Scientific Developments and New Technological Trajectories in Sensor Research","Sensors",1424-8220,,,Article,true,gold,"03 Chemical Sciences; 0301 Analytical Chemistry; 08 Information and Computing Sciences; 0805 Distributed Computing; 09 Engineering; 0906 Electrical and Electronic Engineering; 46 Information and Computing Sciences; 4605 Data Management and Data Science",,"Allameh Tabataba'i University; Collegio Carlo Alberto; University of Birmingham",,2021-11-24,10.3390/s21237803,,,,34883807,,"",,,,,,0,0,0,0,1,0,0,0,0,0,0,0,0,0,0,0,0,19,13,https://www.altmetric.com/details/140031640,https://api.altmetric.com/v1/donut/140031640_240.png,"MDPI"
1,"Assessing the impact of stigma reduction interventions in Iran: A qualitative study from the perspective of mental health stakeholders","Frontiers in Public Health",2296-2565,,,Article,true,gold,"11 Medical and Health Sciences; 1117 Public Health and Health Services; 42 Health Sciences; 4203 Health Services and Systems; 4205 Nursing",,"Aja University of Medical Sciences; Allameh Tabataba'i University; Iran University of Medical Sciences; Shahid Beheshti University of Medical Sciences; Tehran University of Medical Sciences",,2022-12-08,10.3389/fpubh.2022.1027002,,,,,,"",,,,,,0,0,0,0,1,0,0,0,0,0,0,0,0,0,0,0,0,0,0,https://www.altmetric.com/details/139920718,https://api.altmetric.com/v1/donut/139920718_240.png,"Frontiers Media SA"
1,"Cognitive deficits in multiple sclerosis: Auditory and Visual Attention and inhibitory Control",,,,,Article,true,green,"11 Medical and Health Sciences; 1109 Neurosciences; 17 Psychology and Cognitive Sciences; 1701 Psychology; 42 Health Sciences; 4203 Health Services and Systems",,"Allameh Tabataba'i University; Shahid Beheshti University; Shahid Beheshti University of Medical Sciences",,2022-11-17,10.21203/rs.3.rs-2280685/v1,,,,,,"",,,,,,0,0,0,0,1,0,0,0,0,0,0,0,0,0,0,0,0,0,0,https://www.altmetric.com/details/138545339,https://api.altmetric.com/v1/donut/138545339_240.png,"Research Square"
1,"The effectiveness of anodal tDCS and cognitive training on cognitive functions in multiple sclerosis; a randomized, double-blind, parallel-group study","Multiple Sclerosis and Related Disorders",2211-0348,,,Article,false,closed,"11 Medical and Health Sciences; 1109 Neurosciences; 32 Biomedical and Clinical Sciences; 3209 Neurosciences",,"Allameh Tabataba'i University; Shahid Beheshti University; Shahid Beheshti University of Medical Sciences; University of Kentucky",,2022-12-01,10.1016/j.msard.2022.104392,,,,,,"",,,,,,0,0,0,0,1,0,0,0,0,0,0,0,0,0,0,0,0,3,0,https://www.altmetric.com/details/137945651,https://api.altmetric.com/v1/donut/137945651_240.png,"Elsevier BV"
1,"An Investigation on the status of Iran's insurance industry in the underwriting of climate change",,,,,Article,true,green,"15 Commerce, Management, Tourism and Services; 1502 Banking, Finance and Investment; 35 Commerce, Management, Tourism and Services; 41 Environmental Sciences; 4101 Climate Change Impacts and Adaptation","13 Climate Action","Allameh Tabataba'i University; Ferdowsi University of Mashhad",,2022-09-27,10.21203/rs.3.rs-2077736/v1,,,,,,"",,,,,,0,0,0,0,1,0,0,0,0,0,0,0,0,0,0,0,0,0,0,https://www.altmetric.com/details/136507236,https://api.altmetric.com/v1/donut/136507236_240.png,"Research Square"
1,"Teaching Media Literacy to Psychiatry Residents in Iran","Medical Journal Of The Islamic Republic Of Iran","2251-6840, 1016-1430",,,Article,true,gold,"11 Medical and Health Sciences; 1117 Public Health and Health Services; 32 Biomedical and Clinical Sciences",,"Aja University of Medical Sciences; Allameh Tabataba'i University; Bangalore University; Iran University of Medical Sciences; Shahid Beheshti University of Medical Sciences",,2022-06-30,10.47176/mjiri.36.75,,,,36128305,PMC9448491,"",,,,,,0,0,0,0,1,0,0,0,0,0,0,0,0,0,0,0,0,6,0,https://www.altmetric.com/details/136367578,https://api.altmetric.com/v1/donut/136367578_240.png,
1,"Bridging organizational performance gaps using the EFQM excellence model","Quality Management Journal",1068-6967,,,Article,false,closed,"15 Commerce, Management, Tourism and Services; 1503 Business and Management; 35 Commerce, Management, Tourism and Services; 3507 Strategy, Management and Organisational Behaviour",,"Allameh Tabataba'i University; Indian School of Business",,2022-09-12,10.1080/10686967.2022.2112926,,,,,,"",,,,,,0,0,0,0,1,0,0,0,0,0,0,0,0,0,0,0,0,5,1,https://www.altmetric.com/details/136094506,https://api.altmetric.com/v1/donut/136094506_240.png,"GeoScienceWorld; Taylor & Francis"
1,"A Peaceful Interpretation of Jihad in the Qur’an","Studies in Conflict &amp; Terrorism","1057-610X, 1521-0731",,,Article,false,closed,"16 Studies in Human Society; 1602 Criminology; 1606 Political Science; 44 Human Society; 4402 Criminology; 4408 Political Science",,"Allameh Tabataba'i University",,2021-07-01,10.1080/1057610x.2021.1935716,,,,,,"",,,,,,0,0,0,0,1,0,0,0,0,0,0,0,0,0,0,0,0,6,0,https://www.altmetric.com/details/135936527,https://api.altmetric.com/v1/donut/135936527_240.png,"GeoScienceWorld; Taylor & Francis"
1,"Active immunotherapy against pathogenic Cis pT231-tau suppresses neurodegeneration in traumatic brain injury mouse models","Neuropeptides","0143-4179, 1532-2785",,,Article,false,closed,"11 Medical and Health Sciences; 1109 Neurosciences; 32 Biomedical and Clinical Sciences; 3204 Immunology",,"Allameh Tabataba'i University; Islamic Azad University, Science and Research Branch; Razi Vaccine and Serum Research Institute; Royan Institute; Tabriz University of Medical Sciences; United Arab Emirates University","Royan Institute",2022-12-01,10.1016/j.npep.2022.102285,,,,36087426,,"",,,,,,0,0,0,0,1,0,0,0,0,0,0,0,0,0,0,0,0,39,0,https://www.altmetric.com/details/135752415,https://api.altmetric.com/v1/donut/135752415_240.png,"Elsevier BV"
