1,"Effects of Aerobic, Resistance, and Combined Exercise on Markers of Male Reproduction in Healthy Human Subjects: A Randomized Controlled Trial [RETRACTED]","Journal of Strength & Conditioning Research","1064-8011, 1533-4287",,,Article,false,closed,"11 Medical and Health Sciences; 1103 Clinical Sciences; 32 Biomedical and Clinical Sciences; 3202 Clinical Sciences; 3208 Medical Physiology",,"Academic Center for Education, Culture and Research; Allameh Tabataba'i University; University of Giessen",,2019-04-01,10.1519/jsc.0000000000002389,,,"http://journals.lww.com/nsca-jscr/Fulltext/publishahead/The_effects_of_aerobic,_resistance,_and_combined.95601.aspx",30913204,,"",,,,,,0,0,0,0,1,0,0,0,0,0,0,0,0,0,0,0,0,93,9,https://www.altmetric.com/details/30371893,https://api.altmetric.com/v1/donut/30371893_240.png,"Lippincott Williams & Wilkins (LWW)"
1,"PROPOSING AN AGILE STRATEGY FOR A STEEL INDUSTRY SUPPLY CHAIN THROUGH THE INTEGRATION OF BALANCE SCORECARD AND INTERPRETIVE STRUCTURAL MODELING","Journal of Business Economics and Management","1611-1699, 2029-4433",,,Article,true,gold,"15 Commerce, Management, Tourism and Services; 1503 Business and Management; 35 Commerce, Management, Tourism and Services; 3509 Transportation, Logistics and Supply Chains","12 Responsible Consumption and Production","Allameh Tabataba'i University; Hormozgan University; Imam Khomeini International University; Vilnius Gediminas Technical University",,2017-04-21,10.3846/16111699.2017.1279683,,,,,,"",,,,,,0,0,0,0,1,0,0,0,0,0,0,0,0,0,0,0,0,80,8,https://www.altmetric.com/details/19535966,https://api.altmetric.com/v1/donut/19535966_240.png,"VGTU Press"
1,"Differential Analysis of Judicial Proceedings of Crime for Legal Entities","Open Journal of Political Science",,,,Article,true,hybrid,"16 Studies in Human Society; 1606 Political Science; 44 Human Society; 4402 Criminology","16 Peace, Justice and Strong Institutions","Allameh Tabataba'i University",,2017-01-01,10.4236/ojps.2017.72019,,,,,,"",,,,,,0,0,0,0,1,0,0,0,0,0,0,0,0,0,0,0,0,0,0,https://www.altmetric.com/details/18903715,https://api.altmetric.com/v1/donut/18903715_240.png,
1,"A Comparative Study of Group Behavioral Activation and Cognitive Therapy in Reducing Subsyndromal Anxiety and Depressive Symptoms.","Iranian Journal of Psychiatry","1735-4587, 2008-2215",,,Article,false,closed,"11 Medical and Health Sciences; 1103 Clinical Sciences; 32 Biomedical and Clinical Sciences; 3202 Clinical Sciences; 52 Psychology; 5203 Clinical and Health Psychology",,"Allameh Tabataba'i University; Tehran University of Medical Sciences; University of Colorado Colorado Springs; University of Social Welfare and Rehabilitation Sciences",,2015-04-01,,,,,26884782,,"",,,,,,0,0,0,0,0,0,0,1,0,0,0,0,0,0,0,0,0,82,0,https://www.altmetric.com/details/16746077,https://api.altmetric.com/v1/donut/16746077_240.png,
1,"The impact of group play therapy on creativity and control of aggression in preschool children","Cogent Psychology",2331-1908,,,Article,true,gold,"17 Psychology and Cognitive Sciences; 52 Psychology",,"Allameh Tabataba'i University; Shahid Rajaee Teacher Training University; University of Mohaghegh Ardabili",,2016-12-21,10.1080/23311908.2016.1264655,,,,,,"",,,,,,0,0,0,0,1,0,0,0,0,0,0,0,0,0,0,0,0,39,6,https://www.altmetric.com/details/15529482,https://api.altmetric.com/v1/donut/15529482_240.png,"GeoScienceWorld; Taylor & Francis"
1,"A Novel Method to Measure Comprehensive Complexity of Software Based on the Metrics Statistical Model","2010 Fourth UKSim European Symposium on Computer Modeling and Simulation",,,,Article,false,closed,"08 Information and Computing Sciences; 0803 Computer Software; 46 Information and Computing Sciences; 4612 Software Engineering",,"Allameh Tabataba'i University",,2010-11-01,10.1109/ems.2010.92,,,,,,"",,,,,,0,0,0,0,0,0,0,1,0,0,0,0,0,0,0,0,0,9,3,https://www.altmetric.com/details/12039207,https://api.altmetric.com/v1/donut/12039207_240.png,"Institute of Electrical and Electronics Engineers (IEEE)"
1,"The Relationships of Sense of Coherence and Self-Compassion to Worry: the Mediating Role of Personal Intelligence","Current Psychology","0737-8262, 1046-1310, 1936-4733",,,Article,false,closed,"17 Psychology and Cognitive Sciences; 1701 Psychology; 52 Psychology; 5203 Clinical and Health Psychology; 5205 Social and Personality Psychology",,"Allameh Tabataba'i University; University of Mohaghegh Ardabili",,2016-04-27,10.1007/s12144-016-9451-1,,,,,,"",,,,,,0,0,0,0,1,0,0,0,0,0,0,0,0,0,0,0,0,47,12,https://www.altmetric.com/details/7120442,https://api.altmetric.com/v1/donut/7120442_240.png,"Springer Nature"
1,"Information Technology Continuance Intention","International Journal of E-Business Research (IJEBR)","1548-1131, 1548-114X",,,Article,false,closed,"08 Information and Computing Sciences; 0806 Information Systems; 35 Commerce, Management, Tourism and Services; 3503 Business Systems In Context",,"Allameh Tabataba'i University",,2016-01-01,10.4018/ijebr.2016010104,,,,,,"",,,,,,0,0,0,0,0,0,0,1,0,0,0,0,0,0,0,0,0,140,61,https://www.altmetric.com/details/5093744,https://api.altmetric.com/v1/donut/5093744_240.png," IGI Global"
1,"Study of Factors Influencing the Attitude of Local People Toward Geotourism Development in Qeshm National Geopark, Iran","Geoheritage","1867-2477, 1867-2485",,,Article,false,closed,"16 Studies in Human Society; 1608 Sociology; 37 Earth Sciences; 3705 Geology; 3709 Physical Geography and Environmental Geoscience",,"Allameh Tabataba'i University; University of Applied Science and Technology; University of Tehran",,2016-01-08,10.1007/s12371-015-0171-y,,,,,,"",,,,,,0,0,0,0,0,0,0,1,0,0,0,0,0,0,0,0,0,71,20,https://www.altmetric.com/details/4977873,https://api.altmetric.com/v1/donut/4977873_240.png,"Springer Nature"
1,"The defeat-entrapment theory versus Beck’s hopelessness theory of depression and suicidality: A cross-national analysis in Iran and the United States","International Journal of Social Psychiatry","0020-7640, 1741-2854",,,Article,false,closed,"17 Psychology and Cognitive Sciences; 1701 Psychology; 52 Psychology; 5203 Clinical and Health Psychology",,"Allameh Tabataba'i University; Richard Stockton College of New Jersey",,2015-04-27,10.1177/0020764015583921,,,,25921982,,"",,,,,,0,0,0,0,0,0,0,1,0,0,0,0,0,0,0,0,0,48,14,https://www.altmetric.com/details/4915918,https://api.altmetric.com/v1/donut/4915918_240.png,"SAGE Publications"
1,"Psychological determinants of erectile dysfunction among middle-aged men","International Journal of Impotence Research","0955-9930, 1476-5489",,,Article,false,closed,"11 Medical and Health Sciences; 1103 Clinical Sciences; 1117 Public Health and Health Services; 32 Biomedical and Clinical Sciences; 3202 Clinical Sciences; 52 Psychology; 5203 Clinical and Health Psychology",,"Allameh Tabataba'i University; Yerevan State University",,2014-08-28,10.1038/ijir.2014.34,,,,25164317,,"",,,,,,0,0,0,0,0,0,0,1,0,0,0,0,0,0,0,0,0,47,23,https://www.altmetric.com/details/3785897,https://api.altmetric.com/v1/donut/3785897_240.png,"Scientific American; Springer Nature"
1,"Social Roles and Baseline Proxemic Preferences for a Domestic Service Robot","International Journal of Social Robotics","1875-4791, 1875-4805",,,Article,true,hybrid,"08 Information and Computing Sciences; 0801 Artificial Intelligence and Image Processing; 46 Information and Computing Sciences; 4608 Human-Centred Computing",,"Allameh Tabataba'i University; University of Hertfordshire",,2014-04-10,10.1007/s12369-014-0232-4,,,,,,"",,,,,,0,0,0,0,1,0,0,0,0,0,0,0,0,0,0,0,0,118,45,https://www.altmetric.com/details/2895038,https://api.altmetric.com/v1/donut/2895038_240.png,"Springer Nature"
1,"EFL learners' text processing strategies across comprehension vs. integration reading task conditions","System",0346-251X,,,Article,false,closed,"13 Education; 1301 Education Systems; 39 Education; 3901 Curriculum and Pedagogy; 47 Language, Communication and Culture; 4703 Language Studies; 4704 Linguistics",,"Allameh Tabataba'i University; Kharazmi University",,2014-10-01,10.1016/j.system.2014.07.013,,,,,,"",,,,,,0,0,0,0,1,0,0,0,0,0,0,0,0,0,0,0,0,53,9,https://www.altmetric.com/details/2602663,https://api.altmetric.com/v1/donut/2602663_240.png,"Elsevier BV"
1,"Personality Factors and Attitudes Toward Euthanasia in Iran: Implications for End-of-Life Research and Practice","Death Studies","0748-1187, 1091-7683",,,Article,false,closed,"17 Psychology and Cognitive Sciences; 1701 Psychology; 52 Psychology; 5205 Social and Personality Psychology",,"Allameh Tabataba'i University; Oakland University; University of Tehran",,2013-08-09,10.1080/07481187.2012.731026,,,,24517707,,"",,,,,,0,0,0,0,1,0,0,0,0,0,0,0,0,0,0,0,0,57,14,https://www.altmetric.com/details/1694386,https://api.altmetric.com/v1/donut/1694386_240.png,"GeoScienceWorld; Taylor & Francis"
1,"Investigating the Effect of Prayer in Increasing the Mental Health of College Students","Procedia Social and Behavioral Sciences",1877-0428,,,Article,true,gold,"16 Studies in Human Society; 17 Psychology and Cognitive Sciences; 44 Human Society; 52 Psychology",,"Allameh Tabataba'i University; Islamic Azad University of Ahar; Islamic Azad University of Gorgan",,2011-01-01,10.1016/j.sbspro.2011.10.364,,,,,,"",,,,,,0,0,0,0,0,0,0,1,0,0,0,0,0,0,0,0,0,41,0,https://www.altmetric.com/details/660706,https://api.altmetric.com/v1/donut/660706_240.png,"Elsevier BV"
0,"Respiratory issues in patients with multiple sclerosis as a risk factor during SARS-CoV-2 infection: a potential role for exercise","Molecular and Cellular Biochemistry","0300-8177, 1573-4919",,,Article,true,hybrid,"06 Biological Sciences; 0601 Biochemistry and Cell Biology; 31 Biological Sciences; 3101 Biochemistry and Cell Biology",,"Allameh Tabataba'i University; Medbase; Payame Noor University; Razi University; University of Coimbra; University of Zurich",,2022-11-21,10.1007/s11010-022-04610-1,,,,36411399,,"",,,,,,0,0,0,0,0,0,0,0,0,0,0,0,0,0,0,0,0,0,0,https://www.altmetric.com/details/141884338,https://api.altmetric.com/v1/donut/141884338_240.png,"Springer Nature"
0,"Is Biological Rhythm Associated with the Mortality of COVID-19?",,,,,Chapter,false,closed,"11 Medical and Health Sciences; 1117 Public Health and Health Services; 32 Biomedical and Clinical Sciences; 3202 Clinical Sciences","3 Good Health and Well Being","Allameh Tabataba'i University; Birjand University of Medical Sciences; Nottingham Trent University; Shahid Beheshti University",,2022-09-14,10.1007/978-981-19-4189-4_1,,,,,,"",,,,,,0,0,0,0,0,0,0,0,0,0,0,0,0,0,0,0,0,0,0,https://www.altmetric.com/details/141419558,https://api.altmetric.com/v1/donut/141419558_240.png,"Springer Nature"
0,"Teachers’ perceptions and strategies in the development of intercultural communicative competence: The case of international school teachers in Iran","Research in Comparative and International Education",1745-4999,,,Article,false,closed,"13 Education; 1302 Curriculum and Pedagogy; 1303 Specialist Studies In Education; 39 Education; 3901 Curriculum and Pedagogy; 3903 Education Systems",,"Allameh Tabataba'i University",,2022-03-26,10.1177/17454999221077859,,,,,,"",,,,,,0,0,0,0,0,0,0,0,0,0,0,0,0,0,0,0,0,5,0,https://www.altmetric.com/details/140451263,https://api.altmetric.com/v1/donut/140451263_240.png,"SAGE Publications"
0,"International School Teachers in Iran and Their Intercultural Communicative Competence: Does Sociocultural Background Make a Difference?","Journal of Research in International Education","1475-2409, 1741-2943",,,Article,false,closed,"13 Education; 1302 Curriculum and Pedagogy; 39 Education; 3901 Curriculum and Pedagogy",,"Allameh Tabataba'i University",,2022-04-26,10.1177/14752409221091902,,,,,,"",,,,,,0,0,0,0,0,0,0,0,0,0,0,0,0,0,0,0,0,5,0,https://www.altmetric.com/details/140450901,https://api.altmetric.com/v1/donut/140450901_240.png,"SAGE Publications"
0,"Post-Apocalyptic Leftover: The Void of Language in Beckett’s Murphy ‌and Endgame",,,,,Chapter,false,closed,"20 Language, Communication and Culture; 2004 Linguistics; 47 Language, Communication and Culture; 4705 Literary Studies",,"Allameh Tabataba'i University",,2022-10-30,10.1007/978-3-031-12330-6_6,,,,,,"",,,,,,0,0,0,0,0,0,0,0,0,0,0,0,0,0,0,0,0,0,0,https://www.altmetric.com/details/140041776,https://api.altmetric.com/v1/donut/140041776_240.png,"Springer Nature"
0,"Behavioral heterogeneity in the CAPM with evolutionary dynamics","Journal of Evolutionary Economics","0936-9937, 1432-1386",,,Article,true,hybrid,"14 Economics; 1401 Economic Theory; 1402 Applied Economics; 38 Economics; 3801 Applied Economics",,"Allameh Tabataba'i University; Norwegian School of Economics; University of Lucerne; University of Zurich",,2022-08-09,10.1007/s00191-022-00786-3,,,,,,"",,,,,,0,0,0,0,0,0,0,0,0,0,0,0,0,0,0,0,0,2,2,https://www.altmetric.com/details/139627175,https://api.altmetric.com/v1/donut/139627175_240.png,"Springer Nature"
0,"Autism Spectrum Disorder and Inclusive Education",,,,,Chapter,false,closed,"17 Psychology and Cognitive Sciences; 1701 Psychology; 39 Education; 3904 Specialist Studies In Education","4 Quality Education","Allameh Tabataba'i University; Alzahra University",,2022-11-11,10.1007/978-981-16-5908-9_10,,,,,,"",,,,,,0,0,0,0,0,0,0,0,0,0,0,0,0,0,0,0,0,2,0,https://www.altmetric.com/details/138545616,https://api.altmetric.com/v1/donut/138545616_240.png,"Springer Nature"
0,"The inventory-routing problem subject to vehicle failure","Transportation Research: Part E",1366-5545,,,Article,true,green,"01 Mathematical Sciences; 0102 Applied Mathematics; 0103 Numerical and Computational Mathematics; 15 Commerce, Management, Tourism and Services; 1507 Transportation and Freight Services; 35 Commerce, Management, Tourism and Services; 3509 Transportation, Logistics and Supply Chains",,"Allameh Tabataba'i University; Isfahan University of Technology; Kingston University, London, United Kingdom; University of Roehampton",,2019-06-01,10.1016/j.tre.2019.04.009,,,,,,"",,,,,,0,0,0,0,0,0,0,0,0,0,0,0,0,0,0,0,0,40,7,https://www.altmetric.com/details/138453131,https://api.altmetric.com/v1/donut/138453131_240.png,"Elsevier BV"
0,"Developing a model for examining the effect of tacit and explicit knowledge sharing on organizational performance based on EFQM approach","Journal of Science and Technology Policy Management",2053-4620,,,Article,false,closed,"15 Commerce, Management, Tourism and Services; 1503 Business and Management; 35 Commerce, Management, Tourism and Services; 3503 Business Systems In Context; 3504 Commercial Services; 3507 Strategy, Management and Organisational Behaviour; 46 Information and Computing Sciences; 4609 Information Systems",,"Allameh Tabataba'i University; University of Isfahan; University of Tehran",,2014-09-30,10.1108/jstpm-05-2014-0025,,,,,,"",,,,,,0,0,0,0,0,0,0,0,0,0,0,0,0,0,0,0,0,98,24,https://www.altmetric.com/details/137614074,https://api.altmetric.com/v1/donut/137614074_240.png,"Emerald Group Publishing"
0,"A national school-based screening program for mental health problems among children aged 6 to 12 years in Iran: scale development and psychometric evaluation","Mental Health, Religion &amp; Culture","1367-4676, 1469-9737",,,Article,false,closed,"17 Psychology and Cognitive Sciences; 1701 Psychology; 1702 Cognitive Sciences; 52 Psychology; 5205 Social and Personality Psychology",,"Allameh Tabataba'i University; Shahid Beheshti University; Shahid Beheshti University of Medical Sciences; University of East London; University of Social Welfare and Rehabilitation Sciences; University of Tehran",,2022-07-31,10.1080/13674676.2021.2025350,,,,,,"",,,,,,0,0,0,0,0,0,0,0,0,0,0,0,0,0,0,0,0,7,0,https://www.altmetric.com/details/137274730,https://api.altmetric.com/v1/donut/137274730_240.png,"GeoScienceWorld; Taylor & Francis"
0,"Idealized native-speaker linguistic and pragmatic norms in English as an international language: exploring the perceptions of nonnative English teachers","Language and Intercultural Communication","1470-8477, 1747-759X",,,Article,false,closed,"20 Language, Communication and Culture; 2003 Language Studies; 2004 Linguistics; 47 Language, Communication and Culture; 4703 Language Studies; 4704 Linguistics","4 Quality Education","Allameh Tabataba'i University; Islamic Azad University, Tehran; Kharazmi University",,2017-12-17,10.1080/14708477.2017.1413105,,,,,,"",,,,,,0,0,0,0,0,0,0,0,0,0,0,0,0,0,0,0,0,46,15,https://www.altmetric.com/details/135614239,https://api.altmetric.com/v1/donut/135614239_240.png,"GeoScienceWorld; Taylor & Francis"
0,"National and sub-national patterns of mortality from stroke in the Iranian population (1990–2015): Complementary results from the NASBOD study","International Journal of Stroke","1747-4930, 1747-4949",,,Article,false,closed,"11 Medical and Health Sciences; 1117 Public Health and Health Services; 42 Health Sciences; 4202 Epidemiology; 4206 Public Health","3 Good Health and Well Being","Allameh Tabataba'i University; Ministry of Health and Medical Education; Tehran University of Medical Sciences",,2018-09-18,10.1177/1747493018799974,,,,30226449,,"",,,,,,0,0,0,0,0,0,0,0,0,0,0,0,0,0,0,0,0,8,6,https://www.altmetric.com/details/133320230,https://api.altmetric.com/v1/donut/133320230_240.png,"SAGE Publications"
0,"Testing a model of growth mindset, ideal L2 self, boredom, and WTC in an EFL context","Journal of Multilingual and Multicultural Development","0143-4632, 1747-7557",,,Article,false,closed,"13 Education; 1303 Specialist Studies In Education; 20 Language, Communication and Culture; 2004 Linguistics; 39 Education; 3901 Curriculum and Pedagogy; 3903 Education Systems",,"Allameh Tabataba'i University; University of Auckland; University of Kurdistan",,2022-07-19,10.1080/01434632.2022.2100893,,,,,,"",,,,,,0,0,0,0,0,0,0,0,0,0,0,0,0,0,0,0,0,15,11,https://www.altmetric.com/details/132973804,https://api.altmetric.com/v1/donut/132973804_240.png,"GeoScienceWorld; Taylor & Francis"
0,"Improving Robot Navigation and Obstacle Avoidance using Kinect 2.0",,,,,Article,false,closed,"08 Information and Computing Sciences; 0801 Artificial Intelligence and Image Processing; 40 Engineering; 4007 Control Engineering, Mechatronics and Robotics; 46 Information and Computing Sciences; 4602 Artificial Intelligence; 4605 Data Management and Data Science",,"Allameh Tabataba'i University; Qazvin Islamic Azad University; University College London",,,10.1109/icrom.2017.8466145,,,,,,"",,,,,,0,0,0,0,0,0,0,0,0,0,0,0,0,0,0,0,0,9,4,https://www.altmetric.com/details/132848428,https://api.altmetric.com/v1/donut/132848428_240.png,"Institute of Electrical and Electronics Engineers (IEEE)"
0,"How Do Human Capital Empowerments Constitute the Organizational Performance?",,,,,Chapter,false,closed,"17 Psychology and Cognitive Sciences; 1701 Psychology; 35 Commerce, Management, Tourism and Services; 3507 Strategy, Management and Organisational Behaviour; 44 Human Society; 4407 Policy and Administration",,"Allameh Tabataba'i University; Magyar Agrár- és Élettudományi Egyetem; Universiti Tun Abdul Razak; University of Quebec",,2022-07-14,10.1007/978-3-031-08084-5_34,,,,,,"",,,,,,0,0,0,0,0,0,0,0,0,0,0,0,0,0,0,0,0,2,0,https://www.altmetric.com/details/132467481,https://api.altmetric.com/v1/donut/132467481_240.png,"Springer Nature"
0,"The Feldstein–Horioka puzzle in South Africa: A fractional cointegration approach","The Journal of International Trade &amp; Economic Development","0963-8199, 1469-9559",,,Article,true,green,"14 Economics; 1402 Applied Economics; 38 Economics; 3801 Applied Economics; 3802 Econometrics",,"Allameh Tabataba'i University; Feng Chia University; Organisation For Economic Co-Operation and Development; University of Navarra; University of Pretoria",,2016-03-03,10.1080/09638199.2016.1151545,,,,,,"",,,,,,0,0,0,0,0,0,0,0,0,0,0,0,0,0,0,0,0,10,5,https://www.altmetric.com/details/130137565,https://api.altmetric.com/v1/donut/130137565_240.png,"GeoScienceWorld; Taylor & Francis"
0,"Culture, Personality, and Attitudes Toward Euthanasia","OMEGA - Journal of Death and Dying","0030-2228, 1541-3764",,,Article,false,closed,"17 Psychology and Cognitive Sciences; 1701 Psychology; 52 Psychology; 5205 Social and Personality Psychology",,"Allameh Tabataba'i University; Oakland University; University of Illinois at Chicago",,2015-03-04,10.1177/0030222815575280,,,,,,"",,,,,,0,0,0,0,0,0,0,0,0,0,0,0,0,0,0,0,0,26,10,https://www.altmetric.com/details/128581958,https://api.altmetric.com/v1/donut/128581958_240.png,"SAGE Publications"
0,"Legal Framework for Protection of Pharmaceutical Trade Marks in Europe and USA",,,,,Chapter,false,closed,,,"Allameh Tabataba'i University; Shahid Beheshti University of Medical Sciences",,2017-11-26,10.1142/9789813201057_0010,,,,,,"",,,,,,0,0,0,0,0,0,0,0,0,0,0,0,0,0,0,0,0,1,0,https://www.altmetric.com/details/128363904,https://api.altmetric.com/v1/donut/128363904_240.png,"World Scientific Publishing"
0,"The Effects of Self-Myofascial Release on Hamstring and Gastrocnemius Muscles Using Foam Roll on Postural Sway, Knee Proprioception, and Dynamic Balance in Recreationally Active Females","International Journal of Athletic Therapy & Training",2157-7277,,,Article,false,closed,"11 Medical and Health Sciences; 1106 Human Movement and Sports Science; 42 Health Sciences; 4207 Sports Science and Exercise",,"Allameh Tabataba'i University; University of Tehran",,2022-09-01,10.1123/ijatt.2021-0043,,,,,,"",,,,,,0,0,0,0,0,0,0,0,0,0,0,0,0,0,0,0,0,2,0,https://www.altmetric.com/details/126138449,https://api.altmetric.com/v1/donut/126138449_240.png,"Human Kinetics"
0,"A complete and an incomplete algorithm for automated guided vehicle scheduling in container terminals","Computers & Mathematics with Applications",0898-1221,,,Article,true,bronze,"08 Information and Computing Sciences; 0802 Computation Theory and Mathematics; 35 Commerce, Management, Tourism and Services; 46 Information and Computing Sciences; 49 Mathematical Sciences",,"Allameh Tabataba'i University; University of Essex",,2011-02-01,10.1016/j.camwa.2010.12.009,,,,,,"",,,,,,0,0,0,0,0,0,0,0,0,0,0,0,0,0,0,0,0,61,36,https://www.altmetric.com/details/124048536,https://api.altmetric.com/v1/donut/124048536_240.png,"Elsevier BV"
0,"Effects of individual differences, society, and culture on youth‐rated problems and strengths in 38 societies","Journal of Child Psychology & Psychiatry","0021-9630, 1469-7610",,,Article,false,closed,"17 Psychology and Cognitive Sciences; 1701 Psychology; 52 Psychology; 5201 Applied and Developmental Psychology; 5202 Biological Psychology; 5205 Social and Personality Psychology",,"AAB College; Allameh Tabataba'i University; Ankara University; Babeș-Bolyai University; Chinese University of Hong Kong; Chuo University; Columbia University; Erasmus MC; Helsinki University Hospital; Institute of Psychology, Beijing, China; Instituto Nacional de Salud Mental ""Honorio Delgado - Hideyo Noguchi""; Istanbul Bilgi University; Jerusalem Mental Health Center; Lusíada University of Porto; Medical University of Warsaw; Mental Health Services; Mykolas Romeris University; National Center for HIV/AIDS Viral Hepatitis STD and TB Prevention; National University Hospital of Iceland; Norwegian University of Science and Technology; St Olav's University Hospital; Universidade Presbiteriana Mackenzie; University Hospital Centre Zagreb; University of Adelaide; University of Barcelona; University of Cologne; University of Eastern Finland; University of Gothenburg; University of Iceland; University of North Carolina at Chapel Hill; University of Southern Denmark; University of Vermont; University of Zagreb; University of Zurich; Vanderbilt University; Vietnam National University, Hanoi; Vrije Universiteit Amsterdam; Yonsei University","Centers for Disease Control and Prevention, Atlanta, United States",2022-02-15,10.1111/jcpp.13569,,,,35167140,,"",,,,,,0,0,0,0,0,0,0,0,0,0,0,0,0,0,0,0,0,24,1,https://www.altmetric.com/details/123940898,https://api.altmetric.com/v1/donut/123940898_240.png,"Wiley"
0,"Using text mining algorithms in identifying emerging trends for recommender systems","Quality & Quantity","0033-5177, 1573-7845",,,Article,false,closed,"01 Mathematical Sciences; 0104 Statistics; 16 Studies in Human Society; 1608 Sociology; 17 Psychology and Cognitive Sciences; 1701 Psychology; 44 Human Society; 4410 Sociology; 49 Mathematical Sciences; 4905 Statistics",,"Allameh Tabataba'i University; Deakin University; Ton Duc Thang University",,2021-05-31,10.1007/s11135-021-01177-9,,,,,,"",,,,,,0,0,0,0,0,0,0,0,0,0,0,0,0,0,0,0,0,23,2,https://www.altmetric.com/details/123272984,https://api.altmetric.com/v1/donut/123272984_240.png,"Springer Nature"
0,"An efficient Neuroevolution Approach for Heart Disease Detection",,,,,Article,false,closed,"08 Information and Computing Sciences; 0801 Artificial Intelligence and Image Processing; 46 Information and Computing Sciences; 4605 Data Management and Data Science; 4611 Machine Learning",,"Allameh Tabataba'i University; Deakin University",,2019-10-01,10.1109/smc.2019.8913997,,,,,,"",,,,,,0,0,0,0,0,0,0,0,0,0,0,0,0,0,0,0,0,22,26,https://www.altmetric.com/details/123272951,https://api.altmetric.com/v1/donut/123272951_240.png,"Institute of Electrical and Electronics Engineers (IEEE)"
0,"Evaluation of Research Trends in Knowledge Management: A Hybrid Analysis through Burst Detection and Text Clustering","Information Knowledge Systems Management","1389-1995, 1875-8762, 0219-6492",,,Article,false,closed,"08 Information and Computing Sciences; 0806 Information Systems; 46 Information and Computing Sciences; 4605 Data Management and Data Science",,"Allameh Tabataba'i University; University of Tehran",,2020-01-06,10.1142/s0219649219500436,,,,,,"",,,,,,0,0,0,0,0,0,0,0,0,0,0,0,0,0,0,0,0,41,16,https://www.altmetric.com/details/123264347,https://api.altmetric.com/v1/donut/123264347_240.png,"World Scientific Publishing"
