2,"<p>Pragmatic abilities in children with neurodevelopmental disorders: development of Pragmatic Abilities Questionnaire based on the Rasch rating scale model</p>","Psychology Research and Behavior Management",1179-1578,,,Article,true,gold,"17 Psychology and Cognitive Sciences; 1701 Psychology; 52 Psychology; 5204 Cognitive and Computational Psychology",,"Allameh Tabataba'i University; University of Social Welfare and Rehabilitation Sciences",,2019-08-01,10.2147/prbm.s209345,,,,,,"",,,,,,0,0,0,0,3,0,0,0,0,0,0,0,0,0,0,0,0,65,2,https://www.altmetric.com/details/64720875,https://api.altmetric.com/v1/donut/64720875_240.png,"Dove Medical Press Ltd."
2,"A Study of the Relation between Mental health and Academic Performance of Students of the Islamic Azad University Ahvaz Branch","Procedia Social and Behavioral Sciences",1877-0428,,,Article,true,gold,"16 Studies in Human Society; 17 Psychology and Cognitive Sciences; 44 Human Society; 52 Psychology",,"Allameh Tabataba'i University; Islamic Azad University, Tehran",,2014-02-01,10.1016/j.sbspro.2014.01.186,,,,,,"",,,,,,0,0,0,0,2,0,0,0,0,0,0,0,0,0,0,0,0,114,16,https://www.altmetric.com/details/51369828,https://api.altmetric.com/v1/donut/51369828_240.png,"Elsevier BV"
2,"Factors Related to E-learner Dropout: Case Study of IUST Elearning Center","Procedia Social and Behavioral Sciences",1877-0428,,,Article,true,gold,"17 Psychology and Cognitive Sciences; 1701 Psychology; 44 Human Society; 52 Psychology",,"Allameh Tabataba'i University; Iran University of Science and Technology",,2013-07-01,10.1016/j.sbspro.2013.06.100,,,,,,"",,,,,,0,0,0,0,2,0,0,0,0,0,0,0,0,0,0,0,0,95,20,https://www.altmetric.com/details/29903925,https://api.altmetric.com/v1/donut/29903925_240.png,"Elsevier BV"
2,"Is a Clean Development Mechanism project economically justified? Case study of an International Carbon Sequestration Project in Iran","Environmental Science & Pollution Research","0944-1344, 1614-7499",,,Article,false,closed,"03 Chemical Sciences; 05 Environmental Sciences; 06 Biological Sciences; 33 Built Environment and Design; 3302 Building; 38 Economics",,"Allameh Tabataba'i University; Eastern Mediterranean University",,2015-08-29,10.1007/s11356-015-5256-2,,,,26315589,,"",,,,,,0,0,0,0,2,0,0,0,0,0,0,0,0,0,0,0,0,18,4,https://www.altmetric.com/details/4450901,https://api.altmetric.com/v1/donut/4450901_240.png,"Springer Nature"
2,"Atorvastatin and prevention of contrast induced nephropathy following coronary angiography.","Journal of Research in Medical Sciences","1735-1995, 1735-7136",,,Article,false,closed,"11 Medical and Health Sciences; 1103 Clinical Sciences; 32 Biomedical and Clinical Sciences; 3202 Clinical Sciences",,"Allameh Tabataba'i University; Isfahan University of Medical Sciences; Kashan University of Medical Sciences",,2015-03-15,,,,,25767514,PMC4354054,"",,,,,,0,0,0,0,3,0,0,0,0,0,0,0,0,0,0,0,0,14,0,https://www.altmetric.com/details/3797670,https://api.altmetric.com/v1/donut/3797670_240.png,
2,"Exploring the predictive role of teacher immediacy and stroke behaviors in English as a foreign language university students’ academic burnout","Studies in Second Language Learning and Teaching",2083-5205,,,Article,true,gold,"13 Education; 1303 Specialist Studies In Education; 17 Psychology and Cognitive Sciences; 1701 Psychology; 39 Education; 47 Language, Communication and Culture; 4703 Language Studies; 4704 Linguistics",,"Allameh Tabataba'i University; Golestan University; Texas A&M University; University of Bath",,2022-03-21,10.14746/ssllt.2022.12.1.5,,,,,,"",,,,,,0,0,0,0,2,0,0,0,0,0,0,0,0,0,0,0,0,17,11,https://www.altmetric.com/details/125402899,https://api.altmetric.com/v1/donut/125402899_240.png,
2,"Exploring the consequence of social media usage on firm performance","Digital Business",,,,Article,true,gold,"08 Information and Computing Sciences; 0806 Information Systems; 35 Commerce, Management, Tourism and Services; 3503 Business Systems In Context",,"Allameh Tabataba'i University; Chalmers University of Technology",,2021-10-01,10.1016/j.digbus.2021.100013,,,,,,"",,,,,,0,0,0,0,6,0,0,0,0,0,0,0,0,0,0,0,0,77,11,https://www.altmetric.com/details/117324246,https://api.altmetric.com/v1/donut/117324246_240.png,"Elsevier BV"
2,"Digital Technology and Pilgrimage: Shiʿi Rituals of Arbaʿin in Iraq","""Journal of Religion, Media and Digital Culture""",2165-9214,,,Article,false,closed,"16 Studies in Human Society; 1608 Sociology; 47 Language, Communication and Culture; 4701 Communication and Media Studies",,"Allameh Tabataba'i University; University of California, San Diego",,2020-05-01,10.1163/21659214-bja10006,,,,,,"",,,,,,0,0,0,0,2,0,0,0,0,0,0,0,0,0,0,0,0,4,2,https://www.altmetric.com/details/83904050,https://api.altmetric.com/v1/donut/83904050_240.png,"Brill Publishers"
2,"Which neurofeedback session is better for motor skill acquisition; before or after training?","Adaptive Behavior","1059-7123, 1741-2633",,,Article,false,closed,"17 Psychology and Cognitive Sciences; 1701 Psychology; 46 Information and Computing Sciences; 4602 Artificial Intelligence; 4608 Human-Centred Computing; 4611 Machine Learning",,"Allameh Tabataba'i University; Ferdowsi University of Mashhad; Islamic Azad University, Mashhad",,2018-04-23,10.1177/1059712318765948,,,,,,"",,,,,,0,0,0,0,3,0,0,0,0,0,0,0,0,0,0,0,0,20,1,https://www.altmetric.com/details/39969276,https://api.altmetric.com/v1/donut/39969276_240.png,"SAGE Publications"
2,"Network modeling of major depressive disorder symptoms in adult women","Psychological Medicine","0033-2917, 1469-8978",,,Article,false,closed,"11 Medical and Health Sciences; 1103 Clinical Sciences; 1117 Public Health and Health Services; 32 Biomedical and Clinical Sciences; 3202 Clinical Sciences; 52 Psychology; 5202 Biological Psychology",,"Allameh Tabataba'i University; Virginia Commonwealth University",,2022-08-25,10.1017/s0033291722002604,,,,36004799,,"",,,,,,0,0,0,0,6,0,0,0,0,0,0,0,0,0,0,0,0,4,0,https://www.altmetric.com/details/134987255,https://api.altmetric.com/v1/donut/134987255_240.png,"Cambridge University Press; GeoScienceWorld"
2,"Effectiveness of Exercise Training on Male Factor Infertility: A Systematic Review and Network Meta-analysis","Sports Health","1941-7381, 1941-0921",,,Article,true,green,"11 Medical and Health Sciences; 1114 Paediatrics and Reproductive Medicine; 32 Biomedical and Clinical Sciences; 3215 Reproductive Medicine; 42 Health Sciences",,"Allameh Tabataba'i University; Babol University of Medical Sciences; University of Giessen",,2021-11-20,10.1177/19417381211055399,,,,34806474,,"",,,,,,0,0,0,0,4,0,0,2,0,0,0,0,0,0,0,0,0,17,3,https://www.altmetric.com/details/118302551,https://api.altmetric.com/v1/donut/118302551_240.png,"SAGE Publications"
2,"An integrative Bayesian network approach to highlight key drivers in systemic lupus erythematosus","Arthritis Research & Therapy","1478-6362, 1478-6354",,,Article,true,gold,"11 Medical and Health Sciences; 1103 Clinical Sciences; 1107 Immunology; 1117 Public Health and Health Services; 32 Biomedical and Clinical Sciences; 3202 Clinical Sciences; 3204 Immunology","3 Good Health and Well Being","Allameh Tabataba'i University; Institute for Research in Fundamental Sciences; Royan Institute; Sharif University of Technology; Tehran University of Medical Sciences; University of Tehran",,2020-06-23,10.1186/s13075-020-02239-3,,,,32576231,,"",,,,,,0,0,0,0,5,0,0,0,0,0,0,0,0,0,0,0,0,8,7,https://www.altmetric.com/details/84608142,https://api.altmetric.com/v1/donut/84608142_240.png,"BioMed Central; Springer Nature"
2,"Towards a Conceptual Framework for Socio-cognitive Empowerment: Lessons from Intervention Research with Women in Iran","Clinical Social Work Journal","0091-1674, 1573-3343",,,Article,false,closed,"16 Studies in Human Society; 1607 Social Work; 44 Human Society; 4409 Social Work",,"Allameh Tabataba'i University; Karlstad University; University of Social Welfare and Rehabilitation Sciences",,2015-02-06,10.1007/s10615-015-0518-5,,,,,,"",,,,,,0,0,0,0,2,0,0,1,0,0,0,0,0,0,0,0,0,21,4,https://www.altmetric.com/details/3787239,https://api.altmetric.com/v1/donut/3787239_240.png,"Springer Nature"
2,"Oregano (Origanum vulgare) Consumption Reduces Oxidative Stress and Markers of Muscle Damage after Combat Readiness Tests in Soldiers","Nutrients",2072-6643,,,Article,true,gold,"11 Medical and Health Sciences; 1103 Clinical Sciences; 42 Health Sciences; 4207 Sports Science and Exercise",,"Allameh Tabataba'i University; Baqiyatallah University of Medical Sciences; California State University, Long Beach; Medbase; University of British Columbia; University of Kurdistan; University of Rennes 1; University of Zurich",,2022-12-28,10.3390/nu15010137,,,,,,"",,,,,,0,0,0,0,5,0,0,0,0,0,0,0,0,0,0,0,0,2,0,https://www.altmetric.com/details/140605123,https://api.altmetric.com/v1/donut/140605123_240.png,"MDPI"
2,"The Effects of Exercise Training on Recovery of Biochemical and Hematological Outcomes in Patients Surviving COVID-19: A Randomized Controlled Assessor-Blinded Trial","Sports Medicine - Open",2198-9761,,,Article,true,gold,"11 Medical and Health Sciences; 1102 Cardiorespiratory Medicine and Haematology; 42 Health Sciences; 4207 Sports Science and Exercise",,"Allameh Tabataba'i University; Babol University of Medical Sciences; University of Giessen; Urmia University",,2022-12-23,10.1186/s40798-022-00546-4,,,,36562867,,"",,,,,,0,0,0,0,3,0,0,0,0,0,0,1,0,0,0,0,0,1,0,https://www.altmetric.com/details/140485290,https://api.altmetric.com/v1/donut/140485290_240.png,"BioMed Central; Springer Nature"
2,"Activities and challenges of volunteers in confrontation with COVID-19: A qualitative study in Iran","International Journal of Disaster Risk Reduction",2212-4209,,,Article,true,bronze,"11 Medical and Health Sciences; 1117 Public Health and Health Services; 44 Human Society; 4404 Development Studies; 4406 Human Geography",,"Allameh Tabataba'i University; Iran University of Medical Sciences; Lorestan University of Medical Sciences; Qazvin University of Medical Sciences; University of Social Welfare and Rehabilitation Sciences; Urmia University",,2022-11-01,10.1016/j.ijdrr.2022.103314,,,,,,"",,,,,,0,0,0,0,3,0,0,0,0,0,0,0,0,0,0,0,0,16,1,https://www.altmetric.com/details/136493924,https://api.altmetric.com/v1/donut/136493924_240.png,"Elsevier BV"
2,"The effects of tourism market diversification on CO2 emissions: evidence from Australia","Current Issues in Tourism","1368-3500, 1747-7603",,,Article,false,closed,"15 Commerce, Management, Tourism and Services; 1503 Business and Management; 1505 Marketing; 1506 Tourism; 35 Commerce, Management, Tourism and Services; 3506 Marketing; 3508 Tourism; 44 Human Society; 4406 Human Geography",,"Allameh Tabataba'i University; Chaoyang University of Technology; Sultan Qaboos University",,2022-05-15,10.1080/13683500.2022.2071683,,,,,,"",,,,,,0,0,0,0,2,0,0,0,0,0,0,0,0,0,0,0,0,8,2,https://www.altmetric.com/details/128285597,https://api.altmetric.com/v1/donut/128285597_240.png,"GeoScienceWorld; Taylor & Francis"
2,"Developing Grounded Theory Systematic Approach for Public Policy Researches","International Journal of Qualitative Methods",1609-4069,,,Article,false,closed,"16 Studies in Human Society; 1605 Policy and Administration; 44 Human Society; 4407 Policy and Administration; 46 Information and Computing Sciences",,"Allameh Tabataba'i University",,2022-04-11,10.1177/16094069221090357,,,,,,"",,,,,,0,0,0,0,3,0,0,0,0,0,0,0,0,0,0,0,0,14,0,https://www.altmetric.com/details/126574862,https://api.altmetric.com/v1/donut/126574862_240.png,"SAGE Publications"
2,"The Impact of Learning Organizations on Employee Performance with an Emphasis on Network Communication Approach",,,,,Article,true,gold,"01 Mathematical Sciences; 0104 Statistics; 15 Commerce, Management, Tourism and Services; 1503 Business and Management; 17 Psychology and Cognitive Sciences; 1701 Psychology; 35 Commerce, Management, Tourism and Services; 3507 Strategy, Management and Organisational Behaviour; 46 Information and Computing Sciences",,"Allameh Tabataba'i University; Islamic Azad University, Tehran",,2022-03-17,10.14201/eks.26817,,,,,,"",,,,,,0,0,0,0,4,0,0,0,0,0,0,0,0,0,0,0,0,17,3,https://www.altmetric.com/details/124795738,https://api.altmetric.com/v1/donut/124795738_240.png,
2,"Meaning-Making Coping With COVID-19 in Academic Settings: The Case of Sweden","Illness, Crisis & Loss","1054-1373, 1552-6968",,,Article,true,green,"11 Medical and Health Sciences; 1117 Public Health and Health Services; 42 Health Sciences; 4203 Health Services and Systems",,"Allameh Tabataba'i University; Mälardalen University; University of Gaevle; Uppsala University",,2021-07-07,10.1177/10541373211022002,,,,,,"",,,,,,0,0,0,0,2,0,0,0,0,0,0,0,0,0,0,0,0,19,8,https://www.altmetric.com/details/111551572,https://api.altmetric.com/v1/donut/111551572_240.png,"SAGE Publications"
2,"Feasibility of implementing public–private partnership (PPP) in the development of hospital services and optimizing resource allocation in Iran","Cost Effectiveness and Resource Allocation",1478-7547,,,Article,true,gold,"14 Economics; 1402 Applied Economics; 38 Economics; 3801 Applied Economics","17 Partnerships for the Goals","Allameh Tabataba'i University; Iran University of Medical Sciences; Shiraz University of Medical Sciences",,2020-08-03,10.1186/s12962-020-00221-z,,,,,,"",,,,,,0,0,0,0,2,0,0,0,0,0,0,0,0,0,0,0,0,38,2,https://www.altmetric.com/details/87142744,https://api.altmetric.com/v1/donut/87142744_240.png,"BioMed Central; Springer Nature"
2,"Equity or equality: outer and expanding circle teachers’ awareness of and attitudes towards World Englishes and international proficiency tests","Journal of Multilingual and Multicultural Development","0143-4632, 1747-7557",,,Article,false,closed,"20 Language, Communication and Culture; 2004 Linguistics; 39 Education; 3901 Curriculum and Pedagogy","4 Quality Education","Allameh Tabataba'i University",,2020-06-22,10.1080/01434632.2020.1783542,,,,,,"",,,,,,0,0,0,0,6,0,0,0,0,0,0,0,0,0,0,0,0,11,1,https://www.altmetric.com/details/84538250,https://api.altmetric.com/v1/donut/84538250_240.png,"GeoScienceWorld; Taylor & Francis"
2,"Child Support, Consumption, and Labor Supply Decisions of Single-Mother Families","Journal of Family & Economic Issues","1058-0476, 1573-3475",,,Article,false,closed,"14 Economics; 1402 Applied Economics; 38 Economics; 3801 Applied Economics","8 Decent Work and Economic Growth","Allameh Tabataba'i University; University of Georgia, Athens, United States",,2020-06-11,10.1007/s10834-020-09690-z,,,,,,"",,,,,,0,0,0,0,3,0,0,0,0,0,0,0,0,0,0,0,0,17,1,https://www.altmetric.com/details/84189293,https://api.altmetric.com/v1/donut/84189293_240.png,"Springer Nature"
2,"Teachers’ engagement within educational policies and decisions improves classroom practice: The case of Iranian ELT school teachers","Improving Schools","1365-4802, 1475-7583",,,Article,false,closed,"13 Education; 1302 Curriculum and Pedagogy; 1303 Specialist Studies In Education; 39 Education; 3901 Curriculum and Pedagogy; 3902 Education Policy, Sociology and Philosophy","4 Quality Education","Allameh Tabataba'i University",,2020-02-28,10.1177/1365480220906625,,,,,,"",,,,,,0,0,0,0,4,0,0,0,0,0,0,0,0,0,0,0,0,19,1,https://www.altmetric.com/details/76808072,https://api.altmetric.com/v1/donut/76808072_240.png,"SAGE Publications"
2,"Bringing Morgan’s metaphors in organization contexts: An essay review","Cogent Business & Management",2331-1975,,,Article,true,gold,"15 Commerce, Management, Tourism and Services; 1503 Business and Management; 35 Commerce, Management, Tourism and Services; 3503 Business Systems In Context",,"Allameh Tabataba'i University",,2019-03-26,10.1080/23311975.2019.1587808,,,,,,"",,,,,,0,0,0,0,2,0,0,0,0,0,0,0,0,0,0,0,0,104,10,https://www.altmetric.com/details/57822122,https://api.altmetric.com/v1/donut/57822122_240.png,"GeoScienceWorld; Taylor & Francis"
2,"Plasma retinol-binding protein-4 and tumor necrosis factor-α are reduced in postmenopausal women after combination of different intensities of circuit resistance training and Zataria supplementation","Sport Sciences for Health","1824-7490, 1825-1234",,,Article,true,green,"11 Medical and Health Sciences; 1103 Clinical Sciences; 32 Biomedical and Clinical Sciences; 3202 Clinical Sciences; 42 Health Sciences; 4207 Sports Science and Exercise",,"Allameh Tabataba'i University; Baqiyatallah University of Medical Sciences; Islamic Azad University, Aliabad Katoul; Islamic Azad University of Tabriz; Manouba University; Payame Noor University; Shahid Beheshti University; University of Mazandaran; University of North Carolina System; University of Rennes 1","National Institute of Arthritis and Musculoskeletal and Skin Diseases",2019-03-15,10.1007/s11332-019-00544-2,,,,31885723,,"",,,,,,0,0,0,0,4,0,0,0,0,0,0,0,0,0,0,0,0,40,17,https://www.altmetric.com/details/57180977,https://api.altmetric.com/v1/donut/57180977_240.png,"Springer Nature"
2,"Analyzing National Electronic Theses and Dissertations programs from business model perspective","Online Information Review","1468-4527, 1468-4535",,,Article,false,closed,"08 Information and Computing Sciences; 0803 Computer Software; 46 Information and Computing Sciences; 4610 Library and Information Studies",,"Allameh Tabataba'i University; Ministry of Science, Research and Technology; Nyenrode Business University",,2018-04-09,10.1108/oir-08-2016-0223,,,,,,"",,,,,,0,0,0,0,3,0,0,0,0,0,0,0,0,0,0,0,0,49,2,https://www.altmetric.com/details/32850621,https://api.altmetric.com/v1/donut/32850621_240.png,"Emerald Group Publishing"
2,"Poor mental health status and aggression are associated with poor driving behavior among male traffic offenders","Neuropsychiatric Disease and Treatment","1176-6328, 1178-2021",,,Article,true,gold,"11 Medical and Health Sciences; 1117 Public Health and Health Services; 32 Biomedical and Clinical Sciences; 3202 Clinical Sciences; 3209 Neurosciences","3 Good Health and Well Being","Allameh Tabataba'i University; Kermanshah University of Medical Sciences; University of Basel",,2015-08-01,10.2147/ndt.s88835,,,,26316753,,"",,,,,,0,0,0,0,4,0,0,1,0,0,0,0,0,0,0,0,0,57,17,https://www.altmetric.com/details/4386188,https://api.altmetric.com/v1/donut/4386188_240.png,"Dove Medical Press Ltd."
2,"Transliminality and mystical experience: Common thread hypothesis, religious commitment, and psychological adjustment in Iran.","Psychology of religion and spirituality","1941-1022, 1943-1562",,,Article,false,closed,"17 Psychology and Cognitive Sciences; 1701 Psychology; 52 Psychology; 5201 Applied and Developmental Psychology; 5205 Social and Personality Psychology",,"Allameh Tabataba'i University; University of Oregon; University of Tehran; University of Tennessee at Chattanooga",,2014-11-01,10.1037/a0037432,,,,,,"",,,,,,0,0,0,0,2,1,0,0,0,0,0,0,0,0,0,0,0,24,17,https://www.altmetric.com/details/3116158,https://api.altmetric.com/v1/donut/3116158_240.png,"American Psychological Association (APA)"
2,"Criteria and Bias in Native English Teachers’ Assessment of L2 Pragmatic Appropriacy: Content and FACETS Analyses","Asia-Pacific Education Researcher","0119-5646, 2243-7908",,,Article,false,closed,"13 Education; 39 Education; 3901 Curriculum and Pedagogy",,"Allameh Tabataba'i University; Sharif University of Technology",,2013-09-12,10.1007/s40299-013-0118-5,,,,,,"",,,,,,0,0,0,0,1,0,0,1,0,1,0,0,0,0,0,0,0,22,8,https://www.altmetric.com/details/2848673,https://api.altmetric.com/v1/donut/2848673_240.png,"Springer Nature"
2,"Possibility of potential coalitions in gas exports from the Southern Corridor to Europe: a cooperative game theory framework","OPEC Energy Review","1753-0229, 1753-0237",,,Article,false,closed,"16 Studies in Human Society; 1605 Policy and Administration; 38 Economics; 3801 Applied Economics",,"Allameh Tabataba'i University",,2021-02-05,10.1111/opec.12196,,,,,,"",,,,,,0,0,0,0,2,0,0,0,0,0,0,0,0,0,0,0,0,3,0,https://www.altmetric.com/details/100721481,https://api.altmetric.com/v1/donut/100721481_240.png,"Wiley"
2,"Altered ultrasonographic activity of abdominal muscles during breathing in males with and without nonspecific chronic low back pain","Journal of Ultrasound","1876-7931, 1971-3495",,,Article,true,green,"11 Medical and Health Sciences; 1103 Clinical Sciences; 32 Biomedical and Clinical Sciences; 3202 Clinical Sciences; 42 Health Sciences; 4201 Allied Health and Rehabilitation Science",,"Allameh Tabataba'i University; Norwegian University of Science and Technology; University of Social Welfare and Rehabilitation Sciences",,2020-09-09,10.1007/s40477-020-00528-w,,,,,,"",,,,,,0,0,0,0,2,0,0,0,0,0,0,0,0,0,0,0,0,23,3,https://www.altmetric.com/details/89716974,https://api.altmetric.com/v1/donut/89716974_240.png,"Springer Nature"
2,"The therapeutic effect of N‐acetylcysteine as an add‐on to methadone maintenance therapy medication in outpatients with substance use disorders: A randomized, double‐blind, placebo‐controlled clinical trial","Brain and Behavior",2162-3279,,,Article,true,gold,"11 Medical and Health Sciences; 1103 Clinical Sciences; 32 Biomedical and Clinical Sciences; 3202 Clinical Sciences; 3214 Pharmacology and Pharmaceutical Sciences; 52 Psychology; 5202 Biological Psychology",,"Allameh Tabataba'i University; Kashan University of Medical Sciences; Rajiv Gandhi University of Health Sciences",,2022-11-30,10.1002/brb3.2823,,,,36448959,,"",,,,,,0,0,0,0,1,3,0,0,0,0,0,0,0,0,0,0,0,0,0,https://www.altmetric.com/details/139556566,https://api.altmetric.com/v1/donut/139556566_240.png,"ESSOAr; Natural History Museum; Wiley"
2,"Determinants of observing health protocols related to preventing COVID-19 in adult women: A qualitative study in Iran","Frontiers in Public Health",2296-2565,,,Article,true,gold,"11 Medical and Health Sciences; 1117 Public Health and Health Services; 42 Health Sciences; 4203 Health Services and Systems","3 Good Health and Well Being","Allameh Tabataba'i University; Kermanshah University of Medical Sciences; Kharazmi University; Lorestan University of Medical Sciences",,2022-08-19,10.3389/fpubh.2022.969658,,,,36062115,,"",,,,,,0,0,0,0,4,0,0,1,0,0,0,0,0,0,0,0,0,13,1,https://www.altmetric.com/details/134759479,https://api.altmetric.com/v1/donut/134759479_240.png,"Frontiers Media SA"
2,"Effects of High-Intensity Resistance Training on Physical Fitness, Hormonal and Antioxidant Factors: A Randomized Controlled Study Conducted on Young Adult Male Soccer Players","Biology",2079-7737,,,Article,true,gold,"06 Biological Sciences; 31 Biological Sciences",,"Allameh Tabataba'i University; Instituto de Telecomunicações; Life Quality Research Centre; Polytechnic Institute of Santarém; Polytechnic Institute of Viana do Castelo; Research Center in Sports Sciences, Health Sciences and Human Development; University of Isfahan; University School of Physical Education in Wroclaw",,2022-06-13,10.3390/biology11060909,,,,35741430,,"",,,,,,0,0,0,0,5,0,0,0,0,0,0,0,0,0,0,0,0,19,0,https://www.altmetric.com/details/130370400,https://api.altmetric.com/v1/donut/130370400_240.png,"MDPI"
2,"Physical Activity and Natural Products and Minerals in the SARS-CoV-2 Pandemic: An Update","Annals of Applied Sport Science",2322-4479,,,Article,true,gold,"11 Medical and Health Sciences; 1107 Immunology; 1117 Public Health and Health Services; 32 Biomedical and Clinical Sciences; 42 Health Sciences; 4206 Public Health",,"Allameh Tabataba'i University; Coastal Carolina University; Kharazmi University; National Centre for Immunisation Research & Surveillance; Payame Noor University; Razi University; Shahid Beheshti University; University of British Columbia; University of Mazandaran; University of North Carolina System; University of Rennes 2","National Institute of Arthritis and Musculoskeletal and Skin Diseases",2021-04-01,10.29252/aassjournal.976,,,,35237740,,"",,,,,,0,0,0,0,2,0,0,0,0,0,0,0,0,0,0,0,0,71,2,https://www.altmetric.com/details/123979554,https://api.altmetric.com/v1/donut/123979554_240.png,
2,"A two-stage assembly flow-shop scheduling problem with bi-level products structure and machines’ availability constraints","Journal of Industrial and Production Engineering","2168-1015, 2168-1023",,,Article,false,closed,"01 Mathematical Sciences; 0104 Statistics; 08 Information and Computing Sciences; 0801 Artificial Intelligence and Image Processing; 0802 Computation Theory and Mathematics; 40 Engineering; 4014 Manufacturing Engineering",,"Allameh Tabataba'i University; Iran Polymer and Petrochemical Institute; Shahid Beheshti University",,2021-12-09,10.1080/21681015.2021.2010820,,,,,,"",,,,,,0,0,0,0,5,0,0,0,0,0,0,0,0,0,0,0,0,1,1,https://www.altmetric.com/details/119861231,https://api.altmetric.com/v1/donut/119861231_240.png,"GeoScienceWorld; Taylor & Francis"
2,"Hawthorne’s New Pilgrim’s Progress and Antebellum America: Subversion and Containment in “The Celestial Railroad”","Neophilologus","0028-2677, 1572-8668",,,Article,false,closed,"20 Language, Communication and Culture; 2004 Linguistics; 2005 Literary Studies; 47 Language, Communication and Culture; 4705 Literary Studies",,"Allameh Tabataba'i University; University of Tehran",,2021-09-14,10.1007/s11061-021-09702-9,,,,,,"",,,,,,0,0,0,0,2,0,0,0,0,0,0,0,0,0,0,0,0,0,0,https://www.altmetric.com/details/113449130,https://api.altmetric.com/v1/donut/113449130_240.png,"Springer Nature"
2,"Corruption in the Nigeria Judicial System: An Overview","Journal of Financial Crime",1359-0790,,,Article,false,closed,"16 Studies in Human Society; 1606 Political Science; 35 Commerce, Management, Tourism and Services; 3507 Strategy, Management and Organisational Behaviour","16 Peace, Justice and Strong Institutions","Allameh Tabataba'i University",,2018-07-02,10.1108/jfc-01-2017-0005,,,,,,"",,,,,,0,0,0,0,2,0,0,0,0,0,0,0,0,0,0,0,0,23,8,https://www.altmetric.com/details/51554565,https://api.altmetric.com/v1/donut/51554565_240.png,"Emerald Group Publishing"
